{"iteration":14,"timestamp":"2026-07-19T03:57:31Z","hypothesis":"Continuing the raw incumbent on explicit arithmetic state traces will convert result-only behavior into more verifier-valid reasoning without sacrificing arithmetic.","change_summary":"added strict initial full-weight loading, built a 2,500-example natural-language trace curriculum weighted toward weak families, warm-started from iteration 13, stopped after preserving the 250-step gate when validation flattened, and evaluated all 60 development instances","command":"uv run python scripts/train_all_parameters.py --model assets/models/qwen3-0.6b-base --initial-weights runs/iter013-raw-expanded-adamw-500-seed17/weights.safetensors --data assets/data/processed/synthetic-dnl-v3-traces-raw --output-dir runs/iter014-traces-cont-adamw-500-seed17 --optimizer adamw --batch-size 1 --iters 500 --learning-rate 1e-6 --max-seq-length 512 --grad-checkpoint --seed 17 --steps-per-report 50 --steps-per-eval 100 --val-batches 25 --save-every 250","result":{"checkpoint_wall_seconds_approx":192.14,"stopped_live_after_step_300":true,"checkpoint_step":250,"checkpoint_trained_tokens":54322,"peak_metal_gb_observed":6.747,"sampled_validation_loss_start":0.662,"sampled_validation_loss_100":0.281,"sampled_validation_loss_200":0.279,"sampled_validation_loss_300_unsaved":0.218,"dev_answer_accuracy":0.433333,"dev_strict_pass":0.3,"dev_format_valid":0.783333,"dev_per_family_answers":{"integer_expression":11,"gcd_bezout":8,"modular_inverse":1,"quadratic_integer_roots":6,"linear_system":0},"dev_per_family_strict":{"integer_expression":11,"gcd_bezout":0,"modular_inverse":1,"quadratic_integer_roots":6,"linear_system":0},"weights_sha256":"7ab1e989e7e4ca7d509bca81138b0510fa54321d9c2e86f69f3bc0afcb5f76eb"},"baseline":{"iteration_13_dev_answer_accuracy":0.366667,"iteration_13_dev_strict_pass":0.216667,"iteration_13_per_family_answers":{"integer_expression":10,"gcd_bezout":9,"modular_inverse":1,"quadratic_integer_roots":2,"linear_system":0}},"decision":"keep","failure_mode":"Trace supervision materially fixed quadratic sign handling and retained arithmetic, but it did not teach coefficient recovery, modular inversion, or linear elimination. Euclidean remainder chains are often correct while back-substituted coefficients are fabricated; linear outputs imitate determinant language while performing false arithmetic. Longer training on the same trace representation is not yet justified.","next_question":"Will direct coefficient-state recurrences for extended Euclid and explicit equation-scaled elimination steps be more learnable than verbal back-substitution and determinant numerators?","checkpoint":"retain step 250 as the new overall development incumbent; live steps after 250 were intentionally not saved"}
{"event":"ledger_timestamp_correction","timestamp":"2026-07-19T03:59:00Z","correction":"Iteration 13's recorded 2026-07-19T04:15:00Z timestamp is a transcription error because it is later than the subsequent locally observed time. Its artifacts, hashes, commands, and metrics are unaffected; preserve the original append-only line and use event order rather than that timestamp."}
{"event":"artifact_prune","timestamp":"2026-07-19T03:59:00Z","reason":"free disk after a stronger retained incumbent and fully recorded dominance gates","deleted_after_hash_verification":{"runs/iter010-adamw-unmasked-50-seed17/weights.safetensors":"9c41ce13b488ebea579ff6bf47d5c693c3b5f8ad3440c67a357beaa956540c59","runs/iter013-raw-expanded-adamw-500-seed17/0000250_adapters.safetensors":"257bf7a37fe09648d63f96cfd55a3019ac92e6ab900cd9e97bf9563e20ea3ca4"},"recovery":"retrain from the preserved commands, seeds, data hashes, and base model"}
{"iteration":15,"timestamp":"2026-07-19T04:12:00Z","hypothesis":"Direct coefficient-state recurrences and explicit scaled-equation elimination will teach certificates that verbal trace supervision did not.","change_summary":"built 1,200 fresh state-oriented examples excluding 6,066 exact prior and benchmark prompts, continued the iteration-14 incumbent for 300 lower-rate updates, and compared the 100-, 200-, and 300-step checkpoints on the full development set","command":"uv run python scripts/train_all_parameters.py --model assets/models/qwen3-0.6b-base --initial-weights runs/iter014-traces-cont-adamw-500-seed17/weights.safetensors --data assets/data/processed/synthetic-dnl-v4-states-raw --output-dir runs/iter015-states-cont-adamw-300-seed17 --optimizer adamw --batch-size 1 --iters 300 --learning-rate 5e-7 --max-seq-length 512 --grad-checkpoint --seed 17 --steps-per-report 25 --steps-per-eval 100 --val-batches 25 --save-every 100","result":{"wall_seconds":269.94,"peak_metal_gb":6.828,"trained_tokens_300":77815,"validation_loss_start":0.786,"validation_loss_100":0.561,"validation_loss_200":0.519,"validation_loss_300":0.517,"dev_by_step":{"100":{"answers":23,"strict":15,"format":47},"200":{"answers":25,"strict":18,"format":43},"300":{"answers":24,"strict":16,"format":47}},"step_200_per_family_answers":{"integer_expression":11,"gcd_bezout":8,"modular_inverse":0,"quadratic_integer_roots":4,"linear_system":2},"step_200_per_family_strict":{"integer_expression":11,"gcd_bezout":1,"modular_inverse":0,"quadratic_integer_roots":4,"linear_system":2},"weights_100_sha256":"1e00e35d211b27182a9e9ff0c77efb7a912d74f6d2cff67f844bef2640f5ca3c","weights_200_sha256":"cc81f27bd48ca991669618e1163d57e53016c7bac60fc6cbc6b1003d67439b5e","weights_300_sha256":"8d54793f266d311ae8dafff66d4a933f18e11901d1f2223668d41c42a1d6b571"},"baseline":{"iteration_14_answers":26,"iteration_14_strict":18,"iteration_14_per_family_answers":{"integer_expression":11,"gcd_bezout":8,"modular_inverse":1,"quadratic_integer_roots":6,"linear_system":0}},"decision":"revert","failure_mode":"Step 200 proves that the representation can produce the first valid Bezout certificate and two correct linear systems, but capability shifted rather than accumulated: modular inverse fell to zero and quadratics fell from six to four, leaving overall answers below the incumbent with strict passes only tied. Validation loss again failed to select mathematical quality.","next_question":"Can interpolation or a deliberately interleaved rehearsal mix combine the iteration-14 quadratic/inverse behavior with iteration-15's new Bezout/linear behavior?","checkpoint":"iteration 14 remains the primary incumbent; retain iteration-15 step 200 temporarily as a directional specialist and prune steps 100 and 300 after hashes and metrics are recorded"}
{"event":"artifact_prune","timestamp":"2026-07-19T04:13:00Z","reason":"iteration-15 steps 100 and 300 are both dominated by step 200 and the iteration-14 incumbent","deleted_after_hash_verification":{"runs/iter015-states-cont-adamw-300-seed17/0000100_adapters.safetensors":"1e00e35d211b27182a9e9ff0c77efb7a912d74f6d2cff67f844bef2640f5ca3c","runs/iter015-states-cont-adamw-300-seed17/0000300_adapters.safetensors":"8d54793f266d311ae8dafff66d4a933f18e11901d1f2223668d41c42a1d6b571","runs/iter015-states-cont-adamw-300-seed17/weights.safetensors":"8d54793f266d311ae8dafff66d4a933f18e11901d1f2223668d41c42a1d6b571"},"retained":"runs/iter015-states-cont-adamw-300-seed17/0000200_adapters.safetensors"}
{"iteration":16,"timestamp":"2026-07-19T04:18:00Z","hypothesis":"Linear interpolation halfway between the broad iteration-14 incumbent and the iteration-15 certificate specialist may combine their complementary family abilities without more training.","change_summary":"interpolated every one of 310 matching BF16 tensors at alpha 0.5 and evaluated the result on all 60 development instances","command":"uv run python scripts/interpolate_checkpoints.py --checkpoint-a runs/iter014-traces-cont-adamw-500-seed17/weights.safetensors --checkpoint-b runs/iter015-states-cont-adamw-300-seed17/0000200_adapters.safetensors --alpha 0.5 --output runs/iter016-interpolate-a050/weights.safetensors","result":{"dev_answers":22,"dev_strict":17,"dev_format":42,"per_family_answers":{"integer_expression":11,"gcd_bezout":5,"modular_inverse":1,"quadratic_integer_roots":5,"linear_system":0},"weights_sha256":"73eaaec0194dcf127d738a37d0300980086feac1b43a837f3ce390af475c4fee"},"baseline":{"iteration_14_answers":26,"iteration_14_strict":18,"iteration_15_step_200_answers":25,"iteration_15_step_200_strict":18},"decision":"revert","failure_mode":"The halfway model preserved arithmetic and one inverse but lost the specialist's Bezout and linear certificates while also reducing gcd and quadratic accuracy. Complementary behavior is not combined by naive parameter averaging along this path.","next_question":"Can an interleaved low-rate rehearsal curriculum accumulate the new certificate behavior while explicitly replaying the incumbent's quadratic and modular-inverse targets?","checkpoint":"delete after preserving manifest, hash, predictions, and report"}
{"iteration":17,"timestamp":"2026-07-19T04:31:31Z","hypothesis":"A balanced rehearsal mixture at a lower learning rate will add coefficient-state behavior while explicitly replaying the incumbent's inverse and quadratic traces.","change_summary":"built a deterministic 1,200-example mixture balanced across five families and two trace styles, continued iteration 14 for 400 updates at 2e-7, and evaluated the 200- and 400-step checkpoints on all development instances","command":"uv run python scripts/train_all_parameters.py --model assets/models/qwen3-0.6b-base --initial-weights runs/iter014-traces-cont-adamw-500-seed17/weights.safetensors --data assets/data/processed/synthetic-dnl-v5-rehearsal-raw --output-dir runs/iter017-rehearsal-cont-adamw-400-seed17 --optimizer adamw --batch-size 1 --iters 400 --learning-rate 2e-7 --max-seq-length 512 --grad-checkpoint --seed 17 --steps-per-report 50 --steps-per-eval 100 --val-batches 25 --save-every 200","result":{"wall_seconds":341.0,"peak_metal_gb":6.803,"trained_tokens_400":93957,"validation_loss_start":0.603,"validation_loss_100":0.496,"validation_loss_200":0.481,"validation_loss_300":0.491,"validation_loss_400":0.397,"dev_by_step":{"200":{"answers":25,"strict":18,"format":46},"400":{"answers":24,"strict":17,"format":46}},"step_200_per_family_answers":{"integer_expression":11,"gcd_bezout":8,"modular_inverse":1,"quadratic_integer_roots":5,"linear_system":0},"step_200_per_family_strict":{"integer_expression":11,"gcd_bezout":1,"modular_inverse":1,"quadratic_integer_roots":5,"linear_system":0},"weights_200_sha256":"952d5f0043fcb6c6b7886ccb946f11f56cd627526cfbea96b31158427b5de66c","weights_400_sha256":"6dc37c478a2573d1398094d4cc613dd304870e726cd8db15fce5ab009f1407cc"},"baseline":{"iteration_14_answers":26,"iteration_14_strict":18,"iteration_14_per_family_answers":{"integer_expression":11,"gcd_bezout":8,"modular_inverse":1,"quadratic_integer_roots":6,"linear_system":0}},"decision":"revert","failure_mode":"Balanced replay retained the inverse and added one valid Bezout certificate, but it lost one quadratic and never recovered linear systems. Lower validation loss again did not predict the primary mathematical score, and step 400 regressed further.","next_question":"The deterministic arithmetic suite has served its regression-gate purpose; does short natural-language theorem-proof post-training improve held-out proof modeling while retaining the incumbent's verified numeric behavior?","checkpoint":"iteration 14 remains incumbent; delete iteration-17 checkpoints after recording hashes and reports"}
{"event":"sealed_eval_contamination","timestamp":"2026-07-19T04:31:31Z","cause":"During a file-shape inspection, the first three ProofBench rows were printed with their reference arguments, violating the experimenter's sealed-solution boundary.","affected_ids":["APMO-2023-2","APMO-2025-1","APMO-2025-2"],"model_exposure":false,"mitigation":"Do not use any observed content in data design or autoresearch proposals. Exclude these three IDs from any later ProofBench final score; model weights and prompts were never exposed. MA-ProofBench solution and Lean views remain unread.","scientific_effect":"ProofBench is no longer fully experimenter-blind for this run, although the trained model remains unexposed."}
{"event":"artifact_prune","timestamp":"2026-07-19T04:32:00Z","reason":"both iteration-17 checkpoints are dominated by iteration 14","deleted_after_hash_verification":{"runs/iter017-rehearsal-cont-adamw-400-seed17/0000200_adapters.safetensors":"952d5f0043fcb6c6b7886ccb946f11f56cd627526cfbea96b31158427b5de66c","runs/iter017-rehearsal-cont-adamw-400-seed17/0000400_adapters.safetensors":"6dc37c478a2573d1398094d4cc613dd304870e726cd8db15fce5ab009f1407cc","runs/iter017-rehearsal-cont-adamw-400-seed17/weights.safetensors":"6dc37c478a2573d1398094d4cc613dd304870e726cd8db15fce5ab009f1407cc"}}
{"iteration":18,"timestamp":"2026-07-19T04:48:00Z","hypothesis":"A short raw-causal natural-language theorem-proof trial will improve family-held-out proof modeling and qualitative proof generation beyond the numeric incumbent.","change_summary":"converted 4,174/263/226 self-contained ProofWiki and Trench proof examples to raw causal text, trained 100 full-parameter AdamW updates from iteration 14 at context 1024, measured fixed proof loss and numeric retention, and blindly graded five held-out generations against base and incumbent","command":"uv run python scripts/train_all_parameters.py --model assets/models/qwen3-0.6b-base --initial-weights runs/iter014-traces-cont-adamw-500-seed17/weights.safetensors --data assets/data/processed/training-views/self-contained-proof-1024-raw --output-dir runs/iter018-naturalproof-raw-adamw-100-seed17 --optimizer adamw --batch-size 1 --iters 100 --learning-rate 1e-6 --max-seq-length 1024 --grad-checkpoint --seed 17 --steps-per-report 20 --steps-per-eval 25 --val-batches 25 --save-every 100","result":{"wall_seconds_approx":108.0,"peak_metal_gb":5.636,"trained_tokens":24008,"sampled_validation_loss_start":1.46,"sampled_validation_loss_25":1.277,"sampled_validation_loss_50":1.209,"sampled_validation_loss_75":1.064,"sampled_validation_loss_100":1.126,"fixed_valid_25_loss":1.155981,"numeric_dev_answers":19,"numeric_dev_strict":16,"blind_five_problem_mean_score":1.4,"blind_five_problem_truncated":2,"blind_scale_max":4,"weights_sha256":"48b1d2e9b1a64e1b0d845db5431d75806f399d6b474fca6845fa428fc00ffa0c"},"baseline":{"untouched_fixed_valid_25_loss":1.577067,"iteration_14_fixed_valid_25_loss":1.557612,"iteration_14_numeric_answers":26,"iteration_14_numeric_strict":18,"blind_base_mean_score":0.8,"blind_iteration_14_mean_score":1.2},"decision":"revert","failure_mode":"Proof loss and blind qualitative quality improved, but the checkpoint passed only one of five held-out proofs at an essentially-correct level and forgot seven verified numeric answers. The sampled loss curve was best at step 75, so step 100 is dominated pending an exact 75-step reproduction.","next_question":"Does the exact step-75 point retain more verified mathematics while improving proof loss further?","checkpoint":"delete after step-75 reproduction and recording blind outputs, grades, metrics, and hash"}
{"iteration":19,"timestamp":"2026-07-19T04:50:00Z","hypothesis":"Stopping the same natural-proof trajectory at its sampled 75-step validation minimum will improve both proof loss and numeric retention relative to step 100.","change_summary":"exactly reproduced the iteration-18 trajectory for 75 updates from iteration 14 and evaluated the saved checkpoint on the same fixed proof-loss subset and numeric development suite","command":"uv run python scripts/train_all_parameters.py --model assets/models/qwen3-0.6b-base --initial-weights runs/iter014-traces-cont-adamw-500-seed17/weights.safetensors --data assets/data/processed/training-views/self-contained-proof-1024-raw --output-dir runs/iter019-naturalproof-raw-adamw-75-seed17 --optimizer adamw --batch-size 1 --iters 75 --learning-rate 1e-6 --max-seq-length 1024 --grad-checkpoint --seed 17 --steps-per-report 15 --steps-per-eval 25 --val-batches 25 --save-every 75","result":{"wall_seconds_approx":86.0,"peak_metal_gb":5.708,"trained_tokens":18669,"sampled_validation_loss_75":1.062,"fixed_valid_25_loss":1.129919,"numeric_dev_answers":22,"numeric_dev_strict":17,"numeric_per_family_answers":{"integer_expression":11,"gcd_bezout":5,"modular_inverse":2,"quadratic_integer_roots":4,"linear_system":0},"weights_sha256":"829c62c6a36e44f0e6c2fa12de7580bfa06e36e2f09449b7af99322e18085143"},"baseline":{"iteration_18_fixed_valid_25_loss":1.155981,"iteration_18_numeric_answers":19,"iteration_18_numeric_strict":16,"iteration_14_fixed_valid_25_loss":1.557612,"iteration_14_numeric_answers":26,"iteration_14_numeric_strict":18},"decision":"keep","failure_mode":"This is a proof-proxy Pareto improvement over step 100, not an overall model promotion: it still trades four numeric answers and one strict pass for much lower held-out proof loss. Qualitative correctness has not yet been blindly measured at this exact checkpoint.","next_question":"Do ordinary-language concept labels improve held-out proof quality beyond the same proof-only budget, and can they reduce truncation or generic repetition?","checkpoint":"retain as proof-proxy leader alongside iteration-14 numeric incumbent"}
{"event":"artifact_prune","timestamp":"2026-07-19T04:52:00Z","reason":"iteration 18 is dominated by iteration 19 and numbered checkpoints are byte-identical to their canonical weights","deleted_after_hash_verification":{"runs/iter018-naturalproof-raw-adamw-100-seed17/0000100_adapters.safetensors":"48b1d2e9b1a64e1b0d845db5431d75806f399d6b474fca6845fa428fc00ffa0c","runs/iter018-naturalproof-raw-adamw-100-seed17/weights.safetensors":"48b1d2e9b1a64e1b0d845db5431d75806f399d6b474fca6845fa428fc00ffa0c","runs/iter019-naturalproof-raw-adamw-75-seed17/0000075_adapters.safetensors":"829c62c6a36e44f0e6c2fa12de7580bfa06e36e2f09449b7af99322e18085143"},"retained":"runs/iter019-naturalproof-raw-adamw-75-seed17/weights.safetensors"}
{"iteration":20,"timestamp":"2026-07-19T05:02:33Z","hypothesis":"On a corrected family-identical split, 75 updates of plain natural-language proof continuation will improve held-out proof quality while retaining most of the numeric incumbent.","change_summary":"rebuilt the plain proof view with the current family split, verified its 4,179 training IDs exactly match the concept arm, trained 75 full-parameter updates from iteration 14, cross-evaluated both views, ran all 60 numeric development problems, and blindly graded five corrected held-out proof generations","command":"uv run python scripts/train_all_parameters.py --model assets/models/qwen3-0.6b-base --initial-weights runs/iter014-traces-cont-adamw-500-seed17/weights.safetensors --data assets/data/processed/training-views/self-contained-proof-1024-v2-raw --output-dir runs/iter020-proof-v2-raw-adamw-75-seed17 --optimizer adamw --batch-size 1 --iters 75 --learning-rate 1e-6 --max-seq-length 1024 --grad-checkpoint --seed 17 --steps-per-report 15 --steps-per-eval 25 --val-batches 25 --save-every 75","result":{"wall_seconds":77,"peak_metal_gb":5.708,"trained_tokens":15681,"sampled_validation_loss_1":1.554,"sampled_validation_loss_25":1.202,"sampled_validation_loss_50":1.155,"sampled_validation_loss_75":1.072,"fixed_plain_valid_25_loss":0.961269,"fixed_concept_valid_25_loss":1.217724,"numeric_dev_answers":24,"numeric_dev_strict":17,"numeric_per_family_answers":{"integer_expression":11,"gcd_bezout":7,"modular_inverse":1,"quadratic_integer_roots":5,"linear_system":0},"blind_five_problem_mean_score":1.2,"blind_five_problem_truncated":2,"weights_sha256":"ebcae477b12ad229100bdc0fb759dad9e1060d413c637e6516cd9a15a337a743"},"baseline":{"iteration_14_numeric_answers":26,"iteration_14_numeric_strict":18,"iteration_14_blind_corrected_mean_score":1.6,"iteration_19_numeric_answers":22,"iteration_19_numeric_strict":17},"decision":"revert","failure_mode":"The checkpoint achieved much lower teacher-forced proof loss and retained more numeric answers than iteration 19, but blind proof quality fell below the unmodified iteration-14 incumbent on the corrected sample. Next-token proof loss is not selecting actual proof validity, and the ProofWiki-heavy data likely rewards stylistic imitation and source-specific shortcuts.","next_question":"Can a stricter proof-data quality filter or a different proof source improve blind proof validity rather than only continuation loss?","checkpoint":"dominated for the core research objective; preserve metrics and blind artifacts, then delete after hash verification"}
