{"iteration":51,"timestamp":"2026-07-19T10:19:22Z","hypothesis":"Verifier-guided rejection sampling will increase coverage while preserving perfect accepted precision.","change_summary":"Generated eight deterministic candidate settings per held-out problem using four seeds and two temperatures, then accepted only full-response semantic matches.","result":{"prompts":8,"candidates":64,"candidate_valid":26,"greedy_accepted":4,"sampling_accepted":5,"coverage":0.625,"accepted_precision":1.0,"mean_unique_candidates":1.875,"elapsed_seconds":31.024,"peak_metal_gb":1.366,"candidates_sha256":"31a37df8704107cfa1f526b05fa237caf9c3a51977afbbb495c77b3ceb574374","accepted_sha256":"e88851f766edd07daff220b5e5ddd528648d0fd3c6dafa1f75c6e6083c156c9b","report_sha256":"be008a4733a6e4b7b0b1260b939fdda18f6909d1ae3cd67d44a216a74335219f"},"decision":"accept verifier-guided sampling as a precision-preserving inference option","failure_mode":"Eight candidates gained only one additional solved case because candidate diversity was low.","next_question":"Can the model's own likelihood safely predict which greedy claims are correct?"}
{"iteration":52,"timestamp":"2026-07-19T10:19:22Z","hypothesis":"A mean-log-probability threshold chosen for zero false accepts on calibration data will transfer as a safe abstention rule.","change_summary":"Scored each greedy response under the specialist, selected the highest-coverage zero-false-accept threshold on 16 calibration items, and evaluated it once on eight held-out items.","result":{"threshold":-0.0294189453125,"calibration":{"accepted":1,"count":16,"precision":1.0},"test":{"accepted":5,"correct":2,"count":8,"precision":0.4},"report_sha256":"bd514d1c51c606ab3f552ad1f65a9c820b862593fa9da131cfd830c485c319a4"},"decision":"reject self-confidence as an acceptance verifier","failure_mode":"The zero-error calibration threshold collapsed to 40 percent precision under language shift.","next_question":"Can explicit two-stage gcd then divisibility generation improve faithful execution?"}
{"iteration":53,"timestamp":"2026-07-19T10:19:22Z","hypothesis":"Conditioning a second generation step on a verified gcd will isolate and improve the divisibility decision.","change_summary":"Parsed and verified gcd-only content from the one-shot outputs, then prompted the unmodified specialist for a divisibility-only claim.","result":{"original_prompts":8,"stage1_gcd_accepted":5,"stage2_accepted":2,"end_to_end_rate":0.25,"report_sha256":"60d3748d3f214634203de123ff109f37141fdb9d4f336a4d2b341f820e94d357"},"decision":"reject untrained staged decoding","failure_mode":"The second decoder collapsed to the phrase does not divide, leaving only two end-to-end successes.","next_question":"Will a decomposed joint, gcd-only, and verified-gcd curriculum teach both stages?"}
{"iteration":54,"timestamp":"2026-07-19T10:19:22Z","hypothesis":"A decomposed curriculum will improve gcd extraction and teach conditional divisibility without losing one-shot claims.","change_summary":"Expanded 140 source examples into 420 joint, gcd-only, and verified-gcd-to-divisibility examples and continued all 596M parameters for 100 AdamW updates.","result":{"training_rows":420,"validation_rows":30,"validation_loss_start":0.774,"validation_loss_end":0.074,"peak_metal_gb":5.498,"joint":{"semantic":4,"count":8},"stage1_gcd_accepted":6,"stage2_accepted":2,"weights_sha256":"a8d5a8e0b8613badcd5659a57e23fa637adbffb18851a02d7d124c35e9c586d0","joint_report_sha256":"1e77971138c9a51333a827280c4e1a4ae05c1325e9afba18ba4a99c00b744ffa","stage2_report_sha256":"190cb97f39618a50305bd225d84d98e7296b9cd6a171a57e3843eed9441a65f5"},"decision":"retain as the new backbone but reject staged generation as solved","failure_mode":"Gcd-only accuracy improved to six of eight, yet the conditional decoder still emitted does not divide universally and one-shot accuracy stayed four of eight.","next_question":"Is the missing divisibility relation linearly readable from frozen hidden states even when generation fails?"}
{"iteration":55,"timestamp":"2026-07-19T10:19:22Z","hypothesis":"A tiny frozen readout can recover the divisibility relation from the decomposed checkpoint's hidden state.","change_summary":"Fit layer and ridge probes on canonical prompts and measured a small eight-case holdout; treated the result as exploratory because selection and evaluation protocol were not fully separated.","result":{"selected":{"layer":21,"pool":"last","ridge":0.01,"parameters":2048},"holdout_accuracy":0.75,"combined_with_gcd_complete":4,"count":8,"probe_bytes":18256,"probe_sha256":"fa72b5901ea0b27a00ec669b8842bc83b981c4857b85c827bd9b228a8f8a0231","report_sha256":"d76687978a710eedbc293aa557404384d64f9e124fe12f0f7da2defd58f65c9f"},"decision":"use only as a signal to run a fair development-selected probe","failure_mode":"The small sample and exploratory selection could overstate performance; combining with gcd extraction did not beat one-shot generation.","next_question":"Does a configuration selected only on declared development data retain accuracy on sealed holdout?"}
{"iteration":56,"timestamp":"2026-07-19T10:19:22Z","hypothesis":"A development-selected 2,048-parameter readout will show whether divisibility is genuinely encoded in the frozen model.","change_summary":"Fit on 60 canonical items, selected layer 28 last-token ridge 0.001 using eight paraphrase-development items, then evaluated once on eight sealed holdout items.","result":{"train_accuracy":1.0,"development_accuracy":1.0,"holdout_accuracy":0.75,"holdout_correct":6,"holdout_count":8,"combined_with_gcd_complete":4,"probe_parameters":2048,"probe_bytes":18256,"probe_sha256":"825bb9df37cdb82f78e02fe80030032662946e666854cc3b8feea65aba60e5b8","report_sha256":"6f32c4c5509eaf94bfb01a764f92318997c9bad4aa41a3479db2863010ed9e51"},"decision":"accept that relation information is often linearly readable, but not as an end-to-end improvement","failure_mode":"The bottleneck is the intersection of correct gcd extraction and correct relation readout; only four of eight complete claims survive.","next_question":"Does a much larger parameter-disjoint curriculum improve one-shot claims on a statistically useful blind test?"}
{"iteration":57,"timestamp":"2026-07-19T10:19:22Z","hypothesis":"A five-minute, 300-update gate on a 600-instance disjoint curriculum will reveal whether scaling data is still reducing held-out loss.","change_summary":"Built 600 train, 120 validation, and 200 sealed test instances with zero parameter overlap, expanded train to 1,800 decomposed examples, froze baseline predictions, and trained 300 updates without opening test labels.","result":{"counts":{"train":600,"valid":120,"test":200},"expanded_train":1800,"test_prompt_sha256":"2f8320198a534bba14e4081fc46eec74a94d7a5b4efca27704e297eaf63a982b","test_verifier_sha256":"6cdd98d513f2436c5e68ed028e7e2b15f0ca9697f635ded7a8d0fb35246ad159","validation_loss_start":0.219,"validation_loss_step150":0.161,"validation_loss_step300":0.15,"peak_metal_gb":5.48,"weights_sha256":"347eea4d39643fc5470d59208de59cb0ae2f7c7755f5b4fea85f493a95401f8a"},"decision":"continue one final 300-update block based only on the still-improving validation curve","failure_mode":"Training sampled only a fraction of the expanded corpus; the validation gain was slowing and test remained unopened.","next_question":"Does a second deterministic data order produce a blind, paired improvement large enough to distinguish learning from eight-case noise?"}
{"iteration":58,"timestamp":"2026-07-19T10:19:22Z","hypothesis":"Six hundred total curriculum updates will improve exact natural-language atomic claims on a 200-case parameter-disjoint blind test and support unmodified Lean certification.","change_summary":"Continued for 300 updates under a fresh deterministic order, stopped training before test reveal, sealed all 200 predictions, then performed one paired evaluation against the already-sealed iteration-54 baseline and compiled every accepted claim in Lean.","result":{"second_block_validation_loss_start":0.135,"second_block_validation_loss_step150":0.124,"second_block_validation_loss_end":0.117,"peak_metal_gb":5.48,"weights_sha256":"20bb44c959c0c293d60c1e6ae84d686a97a74e6908e6162fe11041250be3f3e5","test":{"count":200,"baseline_semantic":19,"candidate_semantic":32,"baseline_rate":0.095,"candidate_rate":0.16,"delta_pp":6.5,"helped":23,"harmed":10,"mcnemar_exact_two_sided_p":0.03508203336969018,"familiar_baseline":15,"familiar_candidate":26,"novel_baseline":4,"novel_candidate":6,"novel_p":0.75390625,"baseline_predictions_sha256":"014ccad91bb81f1c2b7b0920d4473621d342389c9365e41deca2f3b3d4bfa142","candidate_predictions_sha256":"792cb2f2b8481b63eaa83aa44dbb4179f29654c3844d8101b9e68adb4a459aa3","paired_report_sha256":"4dfe4e2645e85ee23b2379c3b1602faf943cf07d86b5112c04a1d76e39665d4c"},"lean":{"accepted_claims":32,"atomic_certificates":64,"derived_conclusions":32,"compile":"pass","certificate_sha256":"8a64a20031bc5b343254dfa791f6bcd328e827f3895d54c59059e419ff6394f4","manifest_sha256":"9ff75883ab90b53f14ffc269495c36ee8a08adf5b16c183b7cd35b787b69c245"}},"decision":"promote as a real but narrow learned mathematical improvement; stop training on this benchmark","failure_mode":"Most of the gain is tied to familiar language; held-out wording rises only from four to six of 100 and is not significant.","next_question":"Can explicit natural-language surface diversity improve a newly sealed, template-disjoint test without sacrificing arithmetic execution?"}
{"iteration":59,"timestamp":"2026-07-19T10:33:00Z","hypothesis":"Twelve varied natural-language training forms will improve transfer to a separately sealed set of four unseen problem phrasings.","change_summary":"Built a new parameter-disjoint 800/160/200 benchmark with train, development, and test template separation; sealed iteration-58 baseline predictions; trained 300 updates across 2,400 decomposed examples without opening test labels.","result":{"counts":{"train":800,"valid":160,"test":200},"templates":{"train":12,"valid":4,"test":4},"excluded_parameters":920,"test_prompt_sha256":"b6951ad77e565e0c453472972590bfffa8f884f38965d328ee1d5f9849c3c774","test_verifier_sha256":"db73e9f098aa0abca4a3fae386640c1fe3f0c32ef1d4d3300d40a74436ed23d0","oracle_pass":1160,"relation_mutants_rejected":1160,"validation_loss_start":0.264,"validation_loss_step150":0.209,"validation_loss_end":0.195,"peak_metal_gb":5.48,"weights_sha256":"1abb4ec335c213a59ecda2d7b7ec3015b2e4e0fa57d0e312b732da517f338467","baseline_predictions_sha256":"f942c146109b38f0fb4683c55444eb8b58899f498d3cdf7db07ef6fc4e7e87b9"},"decision":"continue one final 300-update block because development-template loss was still improving","failure_mode":"The first block had not seen most of the expanded corpus and test remained sealed.","next_question":"Does a second block create a statistically meaningful gain on the four unseen-language test forms?"}
{"iteration":60,"timestamp":"2026-07-19T10:33:00Z","hypothesis":"Six hundred total language-diversity updates will improve template-disjoint claims beyond the iteration-58 baseline.","change_summary":"Continued for 300 updates under a fresh deterministic order, stopped before test reveal, sealed 200 predictions, then performed one paired evaluation and a component-level error audit.","result":{"second_block_validation_loss_start":0.238,"second_block_validation_loss_step150":0.219,"second_block_validation_loss_end":0.208,"peak_metal_gb":5.48,"weights_sha256":"57d397c51606c67350bd2c4f989725859d023b3b16f9783c99d5086c78c0fb46","test":{"count":200,"baseline_semantic":10,"candidate_semantic":16,"baseline_rate":0.05,"candidate_rate":0.08,"delta_pp":3.0,"helped":15,"harmed":9,"mcnemar_exact_two_sided_p":0.30745625495910645,"baseline_predictions_sha256":"f942c146109b38f0fb4683c55444eb8b58899f498d3cdf7db07ef6fc4e7e87b9","candidate_predictions_sha256":"4e8b7d036e5077911ab9e00a94d245a2ecfde911f0e7451413ddcf1c75e5d645","paired_report_sha256":"50a6bd29bd021f916a4d681c41e6e65049c93f5c011e93cd67a92aa4449a0f32"},"components":{"parsed_rate":1.0,"target_extracted_rate":0.985,"gcd_correct_rate":0.175,"relation_correct_rate":0.495,"component_report_sha256":"8d8ef6d338ffe9f27afac692091c9310220c5ac66977b87521625ade329122cd"}},"decision":"do not promote the language-abstraction claim; retain only the directional signal and improved extraction","failure_mode":"The three-point gain was not statistically distinguishable, and exact gcd computation remained the dominant bottleneck despite nearly perfect target extraction.","next_question":"Can forcing a fully checkable natural-language Euclidean argument improve arithmetic execution rather than merely output form?"}
{"iteration":61,"timestamp":"2026-07-19T11:07:00Z","hypothesis":"Forcing a complete natural-language Euclidean algorithm can convert a 0.6B model from answer-pattern imitation into independently checkable arithmetic reasoning.","change_summary":"Built a parameter-disjoint 800/160/200 trace benchmark with train, development, and test language separation; required every division equality and final claim to pass a strict chain verifier; froze iteration-60 baseline predictions; trained all 596M parameters for 300 updates with 512-token context; stopped at the validation plateau; sealed and revealed 200 candidate arguments; compiled every fully accepted argument in Lean.","result":{"benchmark":{"counts":{"train":800,"valid":160,"test":200},"templates":{"train":8,"valid":3,"test":4},"excluded_parameters":2080,"oracle_pass":1160,"quotient_mutants_rejected":1160,"relation_mutants_rejected":1160,"test_prompt_sha256":"18032602c20428d52af148fd73ef83f91c1c6909e3a885b0983d8aaba7d1d94f","test_verifier_sha256":"21861f79db2793ea1191a892e59f46b8477e659557672f4a2b1af5880a216ab3"},"training":{"validation_loss_start":0.378,"validation_loss_step150":0.08,"validation_loss_end":0.079,"trained_tokens":35336,"peak_metal_gb":5.555,"weights_sha256":"d3c92e96dffed64c615c6c8e2a72090aa547197dd9d1d6d5c2ed20d63519c6b3"},"test":{"count":200,"baseline_semantic":0,"candidate_parsed":191,"candidate_trace_valid":12,"candidate_final_valid":29,"candidate_semantic":7,"candidate_rate":0.035,"helped":7,"harmed":0,"mcnemar_exact_two_sided_p":0.015625,"baseline_predictions_sha256":"69c0e2bc301d42a5c33a7e0a2f795525c3d3bac8ba0d197c99d3e04fca94c2c0","candidate_predictions_sha256":"f142302b4374800f6985afbb862cdcefda6d90cfeab615a92da32b80994cb13a","report_sha256":"afa5c4c8a4fa0b8cf08484491cc5fe1190e3a000e7e6d0e06260f50091c7030a","paired_report_sha256":"4520ce6b159e7e53b931031068ef8f514a86c57a24034b5d3f951ed267764576","generation_seconds":390.58,"generation_prompts_per_second":0.512,"inference_peak_metal_gb":1.36},"lean":{"accepted_arguments":7,"trace_step_certificates":31,"gcd_certificates":7,"divisibility_certificates":7,"derived_conclusions":7,"compile":"pass","certificate_sha256":"d9803b5fc5e51abb3d91d1150c010800e08fcf8fa296910e55e030748ee0ee96","manifest_sha256":"d9f1623ddab2bb0c16deb9a53f88fd54045d3f94f44bc55b1718b512fc5037e4"}},"decision":"promote as the first statistically nontrivial, end-to-end result where the small model contributes a complete multi-step informal argument and Lean certifies every numerical claim and conclusion","failure_mode":"Only seven of 200 full arguments pass; five additional valid traces have a wrong conclusion, and most fluent traces contain fabricated arithmetic despite very low validation loss.","next_question":"Does a sealed small-number curriculum establish a higher reliable regime and reveal how mathematical execution degrades with numeric scale?"}
{"iteration":62,"timestamp":"2026-07-19T11:32:00Z","hypothesis":"The trace-trained model has a substantially higher reliable regime on small operands, and additional small-only training may improve it further.","change_summary":"Sealed a new 800/160/200 small-number trace benchmark with the same language separation and full-chain verifier; froze iteration-61 predictions before training; started a 300-update small-only continuation but killed it when held-out loss worsened; opened only the frozen parent predictions; compiled both strict full arguments and a fixed-external-system pipeline that accepts correct model-computed traces and derives the conclusion downstream.","result":{"benchmark":{"counts":{"train":800,"valid":160,"test":200},"numeric_range":{"gcd_max":12,"factor_max":18,"multiplier_max":15},"excluded_parameters":3240,"oracle_pass":1160,"quotient_mutants_rejected":1160,"max_sequence_tokens":221,"truncated_examples":0,"test_prompt_sha256":"47a1b9fd3e740aa1f22604d524ad26ccf2ce5c0c75f5cf068b18c06ac18f4c2e","test_verifier_sha256":"549040175534f28707ecc0e0cff2be3ffd60759bd704e39bf36aacff60ed1c76"},"small_training_gate":{"validation_loss_start":0.054,"validation_loss_step150":0.07,"train_loss_step150":0.014,"train_loss_step200":0.011,"peak_metal_gb":5.536,"stopped_at_update":200,"checkpoint_saved":false},"test":{"count":200,"parsed":190,"trace_valid":103,"final_valid":103,"strict_complete":64,"strict_rate":0.32,"predictions_sha256":"54bcf0b87fe9fedb0cd8a32a493f40cb935af132bd3049d9574bbca30534e5e7","report_sha256":"74891b371e3a6c275e36acbc3f82483d7976fd3331bc80759dee42101b8a20e7","generation_seconds":283.45,"prompts_per_second":0.706,"inference_peak_metal_gb":1.355},"scale_comparison":{"small_complete":64,"large_complete":7,"each_count":200,"small_rate":0.32,"large_rate":0.035,"odds_ratio":12.9748,"fisher_exact_two_sided_p":9.529017515629862e-15},"lean_strict":{"accepted_arguments":64,"trace_step_certificates":198,"derived_conclusions":64,"compile":"pass","certificate_sha256":"08b8e4929686927822cc5ef741e2abeacaa0aeba92c0903145c1cf51e4cc7933","manifest_sha256":"ba08e2f1ccf142338f23df3601f6897e95f329827d54cf8e7975f83a3a5401e2"},"fixed_external_pipeline":{"large_trace_accepted":12,"large_trace_rate":0.06,"large_trace_step_certificates":54,"large_compile":"pass","large_certificate_sha256":"4af1722a118a88e884287be6a715f769d9cede0fcb8a615dae452f160483e4fe","small_trace_accepted":103,"small_trace_rate":0.515,"small_trace_step_certificates":312,"small_compile":"pass","small_certificate_sha256":"a56afd153e9b1dd46294d6f3a51c0039491f4324e9bfc15409cca25a05f77b1d"}},"decision":"promote the unmodified iteration-61 model as having a real small-number reasoning regime; reject the small-only continuation because it overfit immediately","failure_mode":"Only 64 of 200 outputs get both the complete trace and final sentence right; 39 additional valid traces attach a wrong conclusion, and reliability collapses by almost an order of magnitude at larger numeric scale.","next_question":"Did trace specialization preserve general method concepts, and can the verified-trace architecture separate computation from theorem application without bloating the small model?"}
{"iteration":63,"timestamp":"2026-07-19T11:32:00Z","hypothesis":"The trace specialist retains general mathematical method representations that a tiny sealed readout can route without theorem names in the model.","change_summary":"Applied the unchanged, previously sealed 31 KB base-model routing head to iteration 61 on the untouched 100-item five-family contrast set; performed no fitting or configuration selection.","result":{"accuracy":0.95,"pair_accuracy":0.9,"diophantine_accuracy":1.0,"count":100,"probe_parameters":5120,"probe_bytes":30984,"peak_metal_gb":1.235,"predictions_sha256":"c20b45ad0e38cd11f7cd6f4582064bf1b8580f494118119cce781e18d54a8bcf","report_sha256":"754e5b525b45da6c2e64b4738581b453b058d604baf07cde4282a0d91ceb46ed"},"decision":"retain the small natural-language model plus tiny concept router plus fixed verifier/formalizer architecture","failure_mode":"Closed-set routing is not broad theorem understanding; five polynomial items still route incorrectly, and execution has only been established for one narrow Diophantine concept.","next_question":"Can the complete evidence be consolidated into a reproducible checkpoint card and a precise next-experiment ladder without overstating breadth?"}
