{"iteration":26,"timestamp":"2026-07-19T06:31:55Z","hypothesis":"Gentle sequential training from the iteration-24 blueprint leader on only new examples will preserve useful strategy behavior better than restarting from the numeric incumbent on the combined corpus.","change_summary":"built a 106/8/6 v2-only family split from the 120 new blueprints, continued iteration 24 for 60 full-parameter updates at half the previous learning rate, evaluated all 60 numeric development problems, and blindly compared the same fresh eight-problem blueprint slice against iterations 24 and 25","command":"uv run python scripts/train_all_parameters.py --model assets/models/qwen3-0.6b-base --initial-weights runs/iter024-blueprint-adamw-60-seed17/weights.safetensors --data assets/data/processed/training-views/blueprint-pilot-v2-raw --output-dir runs/iter026-blueprint-sequential-adamw-60-seed17 --optimizer adamw --batch-size 1 --iters 60 --learning-rate 5e-7 --max-seq-length 1024 --grad-checkpoint --seed 17 --steps-per-report 10 --steps-per-eval 30 --val-batches 8 --save-every 60","result":{"wall_seconds":"approximately 50","peak_metal_gb":5.555,"trained_tokens":13743,"sampled_v2_valid_loss_start":1.549,"sampled_v2_valid_loss_step30":1.491,"sampled_v2_valid_loss_step60":1.463,"numeric":{"answers":22,"strict":17,"per_family_strict":{"integer_expression":11,"gcd_bezout":0,"modular_inverse":1,"quadratic_integer_roots":5,"linear_system":0}},"fresh_blind_blueprint_mean":{"iteration_24":1.375,"iteration_25":1.125,"iteration_26":1.25},"fresh_blind_score_3_or_4_all_models":0,"weights_sha256":"8a2d8ebf1698a144e83e7f61ba3e0bb617f37360f8bf6abfc644cbe42c872922","predictions_sha256":"0a141ddd36c86afe864c231ea185dd11af105288f98e2b9c415f8bb9a75da90a","blind_grades_sha256":"17b99a6d717e9a4bca37587176b6796e6b043cb6f1f1603619857d1c4cca93f0"},"baseline":{"iteration_24_numeric_answers":25,"iteration_24_numeric_strict":17,"iteration_24_fresh_blind_mean":1.375},"decision":"revert","failure_mode":"Sequential low-rate training recovered only part of the scaled run's strategy loss and caused substantial numeric forgetting. The original iteration-24 checkpoint remained better on the blind strategy slice with equal strict numeric count and three more correct answers.","next_question":"Is the bottleneck poor or inconsistent distilled blueprint supervision, or is the 0.6B model unable to turn that supervision into viable held-out strategies?","checkpoint":"delete after metrics and hash are recorded"}
{"event":"blueprint_length_control","timestamp":"2026-07-19T06:31:55Z","hypothesis":"Explicitly limiting iteration-24 blueprints to 100 words will prevent rambling and truncation and improve strategy validity.","design":{"model":"iteration 24","problems":8,"original_mean_words":123.25,"limited_mean_words":104.625,"original_completed_with_punctuation":3,"limited_completed_with_punctuation":5},"result":{"blind_mean_original":1.375,"blind_mean_limit_100":1.125,"blind_score_3_or_4":0},"decision":"revert inference prompt change","failure_mode":"The instruction shortened and completed more outputs but removed useful steps; length control did not repair mathematical correctness.","grades_sha256":"3ede5353d70d1c1cf1803ed8c2556c16fd48ce52b0668822b2e505256960779c"}
{"event":"blueprint_top3_sampling","timestamp":"2026-07-19T06:31:55Z","hypothesis":"Cheap stochastic search over three iteration-24 blueprint samples will uncover viable strategies missed by greedy decoding.","design":{"problems":8,"samples_per_problem":3,"arms":["temperature 0 seed 17","temperature 0.7 seed 23","temperature 0.7 seed 47"],"max_tokens":240},"result":{"per_arm_blind_mean":[1.125,1.125,1.125],"per_problem_oracle_best_mean":1.375,"oracle_score_3_or_4":0},"decision":"reject top-3 sampling as a sufficient remedy","failure_mode":"Sampling produced some complementary partial progress but no viable strategy on any problem; search cannot select a correct plan that the model does not generate.","grades_sha256":"2634b877b0d9708256c9abb99f63a1d43bc30a51f35bf6e01e4411f230228c14"}
{"event":"artifact_prune","timestamp":"2026-07-19T06:31:55Z","reason":"free disk while preserving all metrics, hashes, and reproducible commands","deleted_after_hash_verification":{"runs/iter025-blueprint-v1-v2-adamw-180-seed17/0000090_adapters.safetensors":"b3aceb5b11cbc07e59358a9e8cd4d1fdfb1e11924b672ab4142ff07427df078c","runs/iter026-blueprint-sequential-adamw-60-seed17/0000060_adapters.safetensors":"8a2d8ebf1698a144e83e7f61ba3e0bb617f37360f8bf6abfc644cbe42c872922"},"recovery":"retrain from recorded commands and retained starting checkpoints"}
{"event":"blueprint_supervision_audit","timestamp":"2026-07-19T06:39:54Z","research_question":"Is poor strategy generalization explained by mathematically bad distilled blueprint targets?","design":{"rows":180,"independent_graders":2,"rubric":"0-4 strategy correctness and sufficiency","exact_source_coverage":true},"result":{"score_4":171,"score_3":6,"score_2":3,"score_1":0,"score_0":0,"fully_correct_rate":0.95,"viable_rate":0.9833333333},"defect_types":["omitted nontrivial justification","ambiguous problem interpretation","asserted exhaustive computation without audit trail"],"interpretation":"Gross teacher noise is not the main explanation for iteration-25/26 failure. The remaining hypotheses are representation/optimization limits, sample diversity, or a 0.6B abstraction and composition ceiling.","artifact_sha256":{"audit_a":"75a4a7905ffadeacd1c8576b7b164b39ef152edf4c21591c330e059752fbd024","audit_b":"bee68adcbcc5cb893ac29c0bcfbef40ea1dcb05dca5aa33e8fb1c1a216dd13b0"}}
{"iteration":27,"timestamp":"2026-07-19T06:39:54Z","hypothesis":"Linear interpolation between the iteration-24 strategy leader and iteration-25 strict-numeric leader will combine their compatible weight changes into a better Pareto point.","change_summary":"interpolated the two full checkpoints at alpha 0.5, evaluated all 60 numeric development problems, and blindly graded the fresh eight-problem strategy slice against both parents","command":"uv run python scripts/interpolate_checkpoints.py --checkpoint-a runs/iter024-blueprint-adamw-60-seed17/weights.safetensors --checkpoint-b runs/iter025-blueprint-v1-v2-adamw-180-seed17/weights.safetensors --alpha 0.5 --output runs/iter027-merge-iter024-iter025-alpha050/weights.safetensors","result":{"numeric":{"answers":24,"strict":17,"per_family_strict":{"integer_expression":11,"gcd_bezout":0,"modular_inverse":1,"quadratic_integer_roots":5,"linear_system":0}},"fresh_blind_blueprint_mean":{"iteration_24":1.375,"iteration_25":1.125,"merge":1.375},"fresh_blind_score_3_or_4":0,"weights_sha256":"e406ea88d59a5d46c69e07431a34ca1b3bacb085461a4ef37f2db28cb4fd25ec","predictions_sha256":"5631d6a695afe998e31391fef64d1287ce0995f6aa3ac0eeede3cfa8ecd9ce7a","blind_grades_sha256":"bf6525fe6043e66f4fe779793bf95ab77e0a59b497b832db6027fe5e21cf97b7"},"baseline":{"iteration_24_numeric_answers":25,"iteration_24_numeric_strict":17,"iteration_24_fresh_blind_mean":1.375},"decision":"revert","failure_mode":"The merge preserved the strategy parent's partial-plan score but lost one correct numeric answer with no strict or viable-strategy gain, so iteration 24 strictly dominates it.","next_question":"Where does a 0.6B model fail on a clean verified-plan ladder: known templates, paraphrases, or composition?","checkpoint":"delete after hash and metrics are recorded"}
{"event":"artifact_prune","timestamp":"2026-07-19T06:39:54Z","reason":"iterations 26 and 27 are dominated by iteration 24; metrics, exact commands, and hashes are preserved","deleted_after_hash_verification":{"runs/iter026-blueprint-sequential-adamw-60-seed17/weights.safetensors":"8a2d8ebf1698a144e83e7f61ba3e0bb617f37360f8bf6abfc644cbe42c872922","runs/iter027-merge-iter024-iter025-alpha050/weights.safetensors":"e406ea88d59a5d46c69e07431a34ca1b3bacb085461a4ef37f2db28cb4fd25ec"},"recovery":"retrain iteration 26 or rerun deterministic interpolation for iteration 27"}
{"event":"artifact_prune","timestamp":"2026-07-19T06:47:30Z","reason":"make room for the verified-plan matched-arm trials; these proof/state checkpoints failed their recorded promotion gates and are dominated by retained iterations 14 or 24","deleted_after_hash_verification":{"runs/iter015-states-cont-adamw-300-seed17/0000200_adapters.safetensors":"cc81f27bd48ca991669618e1163d57e53016c7bac60fc6cbc6b1003d67439b5e","runs/iter019-naturalproof-raw-adamw-75-seed17/weights.safetensors":"829c62c6a36e44f0e6c2fa12de7580bfa06e36e2f09449b7af99322e18085143","runs/iter022-fineproofs-raw-adamw-25-seed17/weights.safetensors":"ce67a473917129b34c40eb6a8eb678e956e8bbe2099542ca3d40699e1b07f319"},"recovery":"retrain from the recorded commands, data views, seeds, and retained parent checkpoints"}
{"event":"research_realign_verified_plan_ladder","timestamp":"2026-07-19T06:48:30Z","trigger":"Blueprint scaling, longer training, sequential continuation, explicit length control, top-3 sampling, and checkpoint interpolation all failed to produce a viable strategy on the fresh slice; teacher audit found 95% fully correct targets, so further recipe tweaks have low information value.","research_question":"Where does the current 0.6B model fail on clean natural-language mathematical plans: representation learning, parameter transfer, paraphrase abstraction, or proof composition?","design":{"families":["polynomial_value_obstruction","diophantine_solvability","modular_period_prime_filter","finite_double_count","finite_recurrence_period"],"representations":["free blueprint","ordered critical deductions"],"paired_fact_and_length_matching":true,"tiers":["train fit","near template","paraphrase","composition"],"verification":["family-specific exact proof-DAG parser","one-fact mutant rejection","external Lean certificates built only from parsed model claims"]},"hard_preflight":["100% oracle parse and exact verification","100% one-fact mutant rejection","zero semantic/template leakage","matched target facts and length","Lean helper and oracle certificates compile"],"continuation_gate_step100":{"parse_rate_min":0.9,"train_fit_strict_min":0.7,"critical_fact_precision_min":0.9},"promotion_gate_step300":{"train_fit_strict_min":0.9,"near_strict_min":0.7,"paraphrase_strict_min":0.55,"composition_strict_min":0.35,"critical_fact_precision_min":0.98,"numeric_answers_min":24,"numeric_strict_min":16},"interpretation":"This ladder is diagnostic rather than evidence of broad or interesting mathematical ability; it prevents final-answer luck and localizes the abstraction failure before another broad curriculum is attempted."}
{"event":"verified_plan_ladder_preflight","timestamp":"2026-07-19T07:36:40Z","result":"pass","instances":640,"oracle_responses_strict":1280,"oracle_responses_total":1280,"mutants_rejected":640,"mutants_total":640,"unintended_leakage":0,"splits":{"train":300,"valid":50,"train_fit":50,"near":80,"paraphrase":80,"composition":80},"paired_training_token_delta_ratio":0.04907,"lean":{"valid_certificates":50,"composition_certificates":80,"compile_stack":65536,"helper_sha256":"799f6049f77df1257be0426b3022bd8d3156d0760748eb13566f434967fbb91d","valid_sha256":"b5a2f08a7b9b30ba8d43c551c101fa71a2809181bb78d2b6021fb8d779b087ae","composition_sha256":"f340a11875e675ba9eb86f63e0dd20a8c5862f099b837a70c695ccda53897da1"},"trust_boundary":"Lean certificates are generated only after recomputing parsed model claims from public problem parameters; private expected facts are not substituted."}
{"iteration":28,"timestamp":"2026-07-19T07:36:40Z","hypothesis":"One hundred full-parameter updates on the matched free-plan representation will be enough to acquire the plan language and cross the continuation gate.","change_summary":"trained from iteration 14 on all 300 free-plan examples with an unmasked raw-text objective and evaluated the 50-example train-fit subset deterministically","command":"uv run python scripts/train_all_parameters.py --model assets/models/qwen3-0.6b-base --initial-weights runs/iter014-traces-cont-adamw-500-seed17/weights.safetensors --data assets/data/processed/training-views/verified-plan-ladder-free-raw --output-dir runs/iter028-vpl-free-probe100-seed17 --optimizer adamw --batch-size 1 --iters 100 --learning-rate 1e-6 --max-seq-length 512 --grad-checkpoint --seed 17 --steps-per-report 10 --steps-per-eval 50 --val-batches 50 --save-every 100","result":{"validation_loss_start":3.452,"validation_loss_step50":2.286,"validation_loss_step100":1.753,"train_loss_step100":1.829,"trained_tokens":15691,"peak_metal_gb":5.525,"train_fit":{"count":50,"parse_rate":0.0,"strict_plan_rate":0.0,"critical_fact_precision":0.0},"weights_sha256":"be8d0029579693a3b8361e2232dbc3653da22e12309354a68d29228f39b6e3b9","predictions_sha256":"f5f646e1376d735c1bd7800f480b1715b1ff1dbf52e1f6e094592bce608ece9e","details_sha256":"0df1064a9ad4f11806b04f72bd82eb28651ccc39b6433ce7ec1feda25f9f3ae6"},"decision":"stop arm at step-100 gate","failure_mode":"Validation loss improved sharply while no output obeyed the certifiable language; the unmasked objective rewarded predicting problem text and broad prose without teaching a reliable problem-to-plan contract.","next_question":"Is the zero-parse failure specific to free plans, or does the ordered representation fail identically?"}
{"iteration":29,"timestamp":"2026-07-19T07:36:40Z","hypothesis":"The ordered critical-deduction representation will make the output contract easier to acquire than free plans within the same 100-update budget.","change_summary":"ran the matched ordered arm from the identical iteration-14 parent and evaluated the same 50 train-fit instances deterministically","command":"uv run python scripts/train_all_parameters.py --model assets/models/qwen3-0.6b-base --initial-weights runs/iter014-traces-cont-adamw-500-seed17/weights.safetensors --data assets/data/processed/training-views/verified-plan-ladder-ordered-raw --output-dir runs/iter029-vpl-ordered-probe100-seed17 --optimizer adamw --batch-size 1 --iters 100 --learning-rate 1e-6 --max-seq-length 512 --grad-checkpoint --seed 17 --steps-per-report 10 --steps-per-eval 50 --val-batches 50 --save-every 100","result":{"validation_loss_start":3.432,"validation_loss_step50":2.246,"validation_loss_step100":1.655,"train_loss_step100":1.747,"trained_tokens":16191,"peak_metal_gb":5.536,"train_fit":{"count":50,"parse_rate":0.0,"strict_plan_rate":0.0,"critical_fact_precision":0.0},"weights_sha256":"a1d77a41a54a8c058e9ecb99ed60083edf576a262cc5e9eb11a75cb66a5d8270","predictions_sha256":"ef10e4dabe9d23e4c6cddedd91dd797e53f1654293b5e48f5f96425e056c9daf","details_sha256":"7956e9b23f3b20db6d1592670c0f9cd4e8984964ae7b12725c3c4554914add82"},"decision":"stop arm at step-100 gate","failure_mode":"Ordered responses often echoed the requested proof outline but paraphrased the canonical claims and remained mathematically unreliable; strict parsing and certification correctly rejected all 50.","next_question":"Can the model acquire the canonical plan contract when loss is restricted to assistant completions and inference uses the same chat template?"}
{"iteration":30,"timestamp":"2026-07-19T07:50:34Z","hypothesis":"Completion-only loss plus ten repetitions of ten seen ordered examples will determine whether zero parse is merely target dilution rather than a capacity or generation problem.","change_summary":"built a deterministic two-per-family memorization view, trained all parameters for 100 updates with prompt masking and the Qwen chat template, then greedily regenerated the exact ten seen prompts","command":"uv run python scripts/train_all_parameters.py --model assets/models/qwen3-0.6b-base --initial-weights runs/iter014-traces-cont-adamw-500-seed17/weights.safetensors --data assets/data/processed/training-views/verified-plan-ladder-ordered-completion-micro10 --output-dir runs/iter030-vpl-ordered-completion-micro10-probe100-seed17 --optimizer adamw --batch-size 1 --iters 100 --learning-rate 1e-6 --max-seq-length 512 --grad-checkpoint --mask-prompt --seed 17 --steps-per-report 10 --steps-per-eval 50 --val-batches 10 --save-every 100","result":{"validation_loss_start":3.561,"validation_loss_step50":1.284,"validation_loss_step100":0.711,"train_loss_step100":0.746,"trained_tokens":10360,"peak_metal_gb":5.536,"seen10":{"parse_rate":0.0,"strict_plan_rate":0.0},"weights_sha256":"9b5ee12bc2d0d4f1a548aea8aacda469a1055d2c27b724d37a26d41ac2ae037c","predictions_sha256":"428a84991d730682230ced6cc5f3c3a1118788f903b19494dffeedfab3ae0b87"},"decision":"continue diagnostic to 300 updates","failure_mode":"Teacher-forced loss improved far more than raw-text training, but free-running outputs still diverged into paraphrases, multilingual fragments, and loops on exact seen inputs.","next_question":"Does deeper memorization eliminate free-running divergence, or is the Qwen thinking-token boundary itself unstable?"}
{"iteration":31,"timestamp":"2026-07-19T07:50:34Z","hypothesis":"Thirty passes over ten seen examples will drive completion loss low enough for exact free-running reproduction and isolate whether this model can emit the certifiable contract at all.","change_summary":"trained a fresh 300-update completion-masked micro run; audited teacher-forced token accuracy and compared default generation with a fixed empty-thinking prefix that bypasses two unstable special-token transitions","command":"uv run python scripts/train_all_parameters.py --model assets/models/qwen3-0.6b-base --initial-weights runs/iter014-traces-cont-adamw-500-seed17/weights.safetensors --data assets/data/processed/training-views/verified-plan-ladder-ordered-completion-micro10 --output-dir runs/iter031-vpl-ordered-completion-micro10-300-seed17 --optimizer adamw --batch-size 1 --iters 300 --learning-rate 1e-6 --max-seq-length 512 --grad-checkpoint --mask-prompt --seed 17 --steps-per-report 25 --steps-per-eval 100 --val-batches 10 --save-every 300","result":{"validation_loss_start":3.561,"validation_loss_step100":0.716,"validation_loss_step200":0.386,"validation_loss_step300":0.318,"train_loss_step300":0.327,"trained_tokens":31080,"peak_metal_gb":5.536,"teacher_forced_probe":{"example_completion_argmax_accuracy":0.950495,"first_think_token_probability":0.000263,"closing_think_token_probability":0.000233},"default_seen10":{"parse_rate":0.0,"strict_plan_rate":0.0},"empty_think_prefixed_seen10":{"parse_rate":0.0,"strict_plan_rate":0.0,"critical_fact_precision":0.4,"required_fact_recall":0.141667},"weights_sha256":"3ffee4292d195a97b83895fd59327e56b39e6615db08388f46aa9f43c00dc56f","default_predictions_sha256":"64fd2b55bbff8729902572cd6e37b93fa54a01c3b9a2c342f370af9f5746fe16","empty_think_predictions_sha256":"1cc2141510b8356142d237ba12c8a703e7fdc8394f482ea9cf56deeeec05d700","empty_think_details_sha256":"b5b3aa925cd1c97f69b42f46e07ef40d6d87c0a9c58792401e904a7b8fe03e6a"},"decision":"reject exact-parser acquisition as the next scaling target; retain only as a lower-bound diagnostic","failure_mode":"The model learned most teacher-forced content tokens but not Qwen's opening and closing thinking tokens; bypassing those transitions yielded recognizable English plans, yet one early paraphrase still cascaded and exact certification remained zero even on seen examples.","next_question":"Can a stronger faithful formalizer certify useful mathematical content from the free English outputs without repairing or re-solving them?"}
{"event":"faithful_formalizer_probe","timestamp":"2026-07-19T08:10:29Z","architecture":"tiny natural-language mathematician followed by stronger faithful formalizer and Lean verifier","seen_micro10":{"formalizable_any":10,"substantive":7,"self_contained_certifiable":0,"correct_conclusion":1,"correct_conclusion_with_sound_premises":0,"requires_repair_or_resolving":10,"report_sha256":"a1e7cf84e9500fa8e51a18f826aa6a59ca4635384c3d3b16a31addfcf183e533"},"heldout_near_balanced10":{"selection":"first two file-order examples per family","formalizable_any":10,"substantive":8,"self_contained_certifiable":1,"requires_repair_or_resolving":9,"strict_after_unseal":1,"lean_certificates":1,"report_sha256":"fe1f5d54d8a819ee015abc9322bce83d691ef14aa55b969d490f706b84d414b9","lean_sha256":"509743f6de579079b6bfb4c452386749cb296c3b3d9a6a5d7ccfacdea1e1c669"},"decision":"A stronger model can faithfully translate ordinary paraphrases, but cannot convert the current outputs into proofs without adding mathematical work. Formalization is not the present bottleneck; small-model claim correctness and sufficiency are."}
