{"iteration":21,"timestamp":"2026-07-19T05:02:33Z","hypothesis":"Ordinary-language concept labels before each proof will expose mathematical abstractions in the target and improve held-out proof quality at approximately the same trained-token budget as the plain arm.","change_summary":"trained from the same iteration-14 weights on the family-identical concept-plus-proof view for 71 updates, approximately matching the plain arm's token budget, cross-evaluated both views, verified all 60 numeric development problems, confirmed concept-prefix generation on all five samples, and used the same blind judge","command":"uv run python scripts/train_all_parameters.py --model assets/models/qwen3-0.6b-base --initial-weights runs/iter014-traces-cont-adamw-500-seed17/weights.safetensors --data assets/data/processed/training-views/self-contained-concept-proof-1024-raw --output-dir runs/iter021-concept-proof-raw-adamw-71-seed17 --optimizer adamw --batch-size 1 --iters 71 --learning-rate 1e-6 --max-seq-length 1024 --grad-checkpoint --seed 17 --steps-per-report 14 --steps-per-eval 24 --val-batches 25 --save-every 71","result":{"wall_seconds":89,"peak_metal_gb":5.727,"trained_tokens":15970,"sampled_validation_loss_1":1.558,"sampled_validation_loss_24":1.382,"sampled_validation_loss_48":1.199,"sampled_validation_loss_71":1.228,"fixed_plain_valid_25_loss":1.170486,"fixed_concept_valid_25_loss":1.316093,"numeric_dev_answers":24,"numeric_dev_strict":15,"numeric_per_family_answers":{"integer_expression":11,"gcd_bezout":9,"modular_inverse":0,"quadratic_integer_roots":4,"linear_system":0},"concept_prefix_generated":5,"blind_five_problem_mean_score":0.8,"blind_five_problem_truncated":3,"weights_sha256":"d59444e5ce547e70d3ca1d12563fea7ad449eb9b8f07d39031a0b136ca0b27f5"},"baseline":{"iteration_20_trained_tokens":15681,"iteration_20_fixed_plain_valid_25_loss":0.961269,"iteration_20_numeric_answers":24,"iteration_20_numeric_strict":17,"iteration_20_blind_mean_score":1.2,"iteration_14_blind_corrected_mean_score":1.6},"decision":"revert","failure_mode":"The model learned the requested representation format and produced superficially relevant concept labels on every sample, but both proof loss and blind proof quality were worse than the equal-budget plain arm, while strict numeric retention also fell. Concept names alone added an easy auxiliary imitation task, not evidence of improved mathematical reasoning.","next_question":"Which source and filtering signals distinguish coherent, self-contained proof supervision from terse cross-reference imitation and malformed mathematical text?","checkpoint":"delete after hashes, metrics, blind packet, key, and grades are preserved"}
{"event":"artifact_prune","timestamp":"2026-07-19T05:03:00Z","reason":"iterations 20 and 21 failed the blind proof-quality gate and are dominated by retained iteration 14 for verified mathematics and corrected qualitative quality","deleted_after_hash_verification":{"runs/iter020-proof-v2-raw-adamw-75-seed17/weights.safetensors":"ebcae477b12ad229100bdc0fb759dad9e1060d413c637e6516cd9a15a337a743","runs/iter021-concept-proof-raw-adamw-71-seed17/weights.safetensors":"d59444e5ce547e70d3ca1d12563fea7ad449eb9b8f07d39031a0b136ca0b27f5"},"recovery":"retrain from the recorded data views, commands, base checkpoint, and seeds"}
{"iteration":22,"timestamp":"2026-07-19T05:13:56Z","hypothesis":"A matched-token short trial on teacher-graded, self-contained FineProofs solutions will improve blind proof validity more than the terse ProofWiki-heavy source.","change_summary":"rebuilt a corrected family split of the 641 FineProofs examples that fit 1,024 tokens, trained 25 full-parameter AdamW updates from iteration 14, compared fixed held-out loss, ran the 60-problem numeric regression suite, and blindly graded five FineProofs validation problems against iterations 14 and 19","command":"uv run python scripts/train_all_parameters.py --model assets/models/qwen3-0.6b-base --initial-weights runs/iter014-traces-cont-adamw-500-seed17/weights.safetensors --data assets/data/processed/training-views/fineproofs-proof-1024-v2-raw --output-dir runs/iter022-fineproofs-raw-adamw-25-seed17 --optimizer adamw --batch-size 1 --iters 25 --learning-rate 1e-6 --max-seq-length 1024 --grad-checkpoint --seed 17 --steps-per-report 5 --steps-per-eval 12 --val-batches 25 --save-every 25","result":{"wall_seconds":111,"peak_metal_gb":5.789,"trained_tokens":19093,"sampled_validation_loss_1":1.088,"sampled_validation_loss_12":1.027,"sampled_validation_loss_24":1.028,"sampled_validation_loss_25":0.963,"fixed_valid_25_loss_baseline":1.074903,"fixed_valid_25_loss_candidate":0.986584,"numeric_dev_answers":21,"numeric_dev_strict":16,"numeric_per_family_answers":{"integer_expression":11,"gcd_bezout":5,"modular_inverse":1,"quadratic_integer_roots":4,"linear_system":0},"blind_five_problem_mean_score":1.4,"blind_five_problem_truncated":3,"blind_score_3_or_4_count":0,"weights_sha256":"ce67a473917129b34c40eb6a8eb678e956e8bbe2099542ca3d40699e1b07f319"},"baseline":{"iteration_14_numeric_answers":26,"iteration_14_numeric_strict":18,"iteration_14_same_sample_blind_mean":1.2,"iteration_19_same_sample_blind_mean":1.2},"decision":"keep","failure_mode":"The higher-quality source produced a small blind improvement, but all five outputs still had major gaps and numeric retention fell by five answers. This is a directional proof-quality checkpoint, not a successful mathematician or an overall promotion.","next_question":"Does continuing the exact trajectory to 50 updates compound blind proof gains or only lower loss while increasing forgetting?","checkpoint":"retain temporarily as the FineProofs step-25 proof candidate; reproduce in a continuous 50-step run before deciding promotion"}
{"iteration":23,"timestamp":"2026-07-19T05:26:14Z","hypothesis":"Continuing FineProofs supervision from 25 to 50 updates will compound blind proof gains rather than merely lower next-token loss.","change_summary":"ran a continuous 50-update FineProofs trajectory from iteration 14 with checkpoints at 25 and 50, evaluated both on the same fixed validation slice and all 60 numeric problems, and blindly compared both durations with iteration 14 on the same five FineProofs problems","command":"uv run python scripts/train_all_parameters.py --model assets/models/qwen3-0.6b-base --initial-weights runs/iter014-traces-cont-adamw-500-seed17/weights.safetensors --data assets/data/processed/training-views/fineproofs-proof-1024-v2-raw --output-dir runs/iter023-fineproofs-raw-adamw-50-seed17 --optimizer adamw --batch-size 1 --iters 50 --learning-rate 1e-6 --max-seq-length 1024 --grad-checkpoint --seed 17 --steps-per-report 10 --steps-per-eval 25 --val-batches 25 --save-every 25","result":{"wall_seconds":161,"peak_metal_gb":7.038,"trained_tokens_50":36313,"fixed_valid_25_loss_step25":0.980658,"fixed_valid_25_loss_step50":0.972353,"numeric_step25":{"answers":21,"strict":17},"numeric_step50":{"answers":23,"strict":16},"blind_mean_step25":1.2,"blind_mean_step50":1.2,"blind_mean_iteration14":1.2,"blind_score_3_or_4_count_all_models":0,"step25_sha256":"e304e57adfd66a25757ac0195ccb304f253445ef259649720e6bf29b3178382e","step50_sha256":"3f283bd6676086c73a195a7fe49c0ce9e8b9bc71801d6c8228c15233a0719e90"},"baseline":{"iteration_22_blind_mean":1.4,"iteration_22_numeric_answers":21,"iteration_22_numeric_strict":16},"decision":"revert","failure_mode":"Doubling the proof updates only nudged fixed loss, did not improve any blind proof score, and traded away the remaining modular-inverse strict pass. The apparent step-25 gain in iteration 22 did not reproduce under this training schedule.","next_question":"Can compact natural-language proof blueprints teach strategy more efficiently than full long-form proof imitation?","checkpoint":"delete both iteration-23 checkpoints after metrics, hashes, and blind artifacts are preserved"}
{"event":"training_rng_correction","timestamp":"2026-07-19T05:26:14Z","cause":"MLX-LM's stock validation and training iterators shared NumPy's process-global RNG, so validation calls changed later training permutations.","affected_scope":"All iterations through 23 remain reproducible from their exact recorded commands, but changing steps_per_eval changes the trained example sequence. Cross-run claims that assumed evaluation-cadence invariance, especially the attempted iteration-22/23 step-25 reproduction, must not be treated as exact trajectory reproductions.","fix":"train_all_parameters.py now seeds validation with a fixed independent seed and restores the training RNG state after every validation call.","verification":{"method":"two three-update full-parameter SGD runs with steps_per_eval 1 versus 1000","frequent_eval_sha256":"4409499d63e035356acefdc28446ce4a0a428652758fb61398f15b8ddca780dc","boundary_eval_sha256":"4409499d63e035356acefdc28446ce4a0a428652758fb61398f15b8ddca780dc","byte_identical":true},"scientific_effect":"Future trajectories are cadence-invariant; prior artifact metrics remain observations of their exact configurations but not interchangeable across evaluation schedules."}
{"event":"artifact_prune","timestamp":"2026-07-19T05:27:00Z","reason":"iteration 23 failed to improve blind proof quality at either duration and its checkpoints are fully recorded","deleted_after_hash_verification":{"runs/iter023-fineproofs-raw-adamw-50-seed17/0000025_adapters.safetensors":"e304e57adfd66a25757ac0195ccb304f253445ef259649720e6bf29b3178382e","runs/iter023-fineproofs-raw-adamw-50-seed17/weights.safetensors":"3f283bd6676086c73a195a7fe49c0ce9e8b9bc71801d6c8228c15233a0719e90"},"recovery":"retrain with the exact pre-correction command to reproduce those historical trajectories"}
{"iteration":24,"timestamp":"2026-07-19T05:45:55Z","hypothesis":"A tiny model can learn useful mathematical strategy more efficiently from compact ordinary-language proof blueprints than from full long-form proof imitation or concept names alone.","change_summary":"used two independent frontier-model teachers to distill 60 training-only FineProofs solutions into 56-105 word ordinary-language blueprints, split them by family into 47/8/5 raw examples, trained 60 full-parameter AdamW updates from iteration 14 with the corrected RNG-isolated wrapper, evaluated 30- and 60-step numeric retention, and blindly graded eight held-out blueprint generations against iteration 14 and the full-proof iteration 22","command":"uv run python scripts/train_all_parameters.py --model assets/models/qwen3-0.6b-base --initial-weights runs/iter014-traces-cont-adamw-500-seed17/weights.safetensors --data assets/data/processed/training-views/blueprint-pilot-v1-raw --output-dir runs/iter024-blueprint-adamw-60-seed17 --optimizer adamw --batch-size 1 --iters 60 --learning-rate 1e-6 --max-seq-length 1024 --grad-checkpoint --seed 17 --steps-per-report 10 --steps-per-eval 30 --val-batches 8 --save-every 30","result":{"wall_seconds":59,"peak_metal_gb":6.747,"trained_tokens_60":14985,"sampled_blueprint_valid_loss_start":1.958,"sampled_blueprint_valid_loss_30":1.687,"sampled_blueprint_valid_loss_60":1.599,"numeric_step30":{"answers":24,"strict":17},"numeric_step60":{"answers":25,"strict":17},"numeric_step60_per_family_answers":{"integer_expression":11,"gcd_bezout":8,"modular_inverse":1,"quadratic_integer_roots":5,"linear_system":0},"blind_eight_problem_blueprint_mean":1.5,"blind_eight_problem_score_3_or_4":1,"blind_eight_problem_truncated":2,"teacher_output_sha256":{"shard_00":"55c0b398d53ab51fb1b12956cc16980ed009ae15916c510d8c68bb517210ac9b","shard_01":"167b1a9cb4616c25b86632779b73661c30ad8b605ee6569c5ab565373bc2914b"},"step30_sha256":"ef13ba1487e90a40e1394780df896cb13cbde5aaf589caa24509beb0140878f7","step60_sha256":"00d1e697f6704a7e07a776c61b05f08369766a668c92a42e13430423ab185f30"},"baseline":{"iteration_14_numeric_answers":26,"iteration_14_numeric_strict":18,"iteration_14_same_blueprint_prompt_blind_mean":1.25,"iteration_22_full_proof_same_prompt_blind_mean":1.0,"iteration_22_numeric_answers":21,"iteration_22_numeric_strict":16},"decision":"keep","failure_mode":"The representation produced the strongest evidence so far and much less forgetting, but seven of eight strategies still had major gaps or errors. One viable blueprint is a signal, not proof of a useful mathematician.","next_question":"Does scaling diverse high-quality blueprint supervision from 60 to roughly 180 examples increase viable held-out strategies without sacrificing the near-incumbent numeric retention?","checkpoint":"retain step 60 as the blueprint Pareto leader; delete step 30 after metrics and hash are preserved"}
{"event":"artifact_prune","timestamp":"2026-07-19T05:46:30Z","reason":"iteration-24 step 60 dominates step 30 on blueprint loss, numeric answers, and the selected blueprint proxy","deleted_after_hash_verification":{"runs/iter024-blueprint-adamw-60-seed17/0000030_adapters.safetensors":"ef13ba1487e90a40e1394780df896cb13cbde5aaf589caa24509beb0140878f7"},"retained":"runs/iter024-blueprint-adamw-60-seed17/weights.safetensors"}
{"event":"lean_runtime_and_certificate_verification","timestamp":"2026-07-19T05:58:36Z","runtime":{"lean":"4.28.0","lake":"5.0.0","project":"verifier"},"source_iteration":24,"strict_numeric_passes":17,"lean_certificates_emitted":17,"unsupported_strict_ids":[],"command":"cd verifier && ~/.elan/bin/lake env lean GeneratedNumericCertificates.lean","exit_code":0,"certificate_sha256":"5ab0026068a45f1e62021209ec5901e2e804c20f2034643f3007f8b06b0358fc","manifest_sha256":"9b3b3f9cd14e3bca4b5cfe7fb0c2a1db81e706d230ef62ffadb86e40d2e6435f","contract":"Each theorem restates the exact private verifier claim for a model response already accepted by the strict parser; Lean independently checks the arithmetic claim, not the natural-language parser.","interpretation":"This validates external Lean certification for supported strict numeric answers while preserving a natural-language-only small model. It is not end-to-end formalization from the model text."}
{"event":"downstream_proof_writer_proxy","timestamp":"2026-07-19T06:16:06Z","research_question":"Does a proof blueprint from the trained small model improve a fixed stronger proof writer over the natural-language statement alone or an untrained small-model blueprint?","design":{"problems":8,"source":"held-out FineProofs validation slice","conditions":["statement only","iteration-14 blueprint","iteration-24 trained blueprint"],"proof_writers":"three separate instances of the same external frontier language model","judge":"independent blind grader","rubric":"0-4 mathematical correctness and completeness"},"result":{"statement_only":{"mean":4.0,"fully_correct":8},"iteration_14_blueprint":{"mean":4.0,"fully_correct":8},"iteration_24_blueprint":{"mean":3.75,"fully_correct":7,"major_gap":1}},"failure_mode":"The trained blueprint imposed an increasing-order restriction on fineproofs-01356, causing the downstream writer to miss the valid decreasing construction of length 2024. The stronger writer solved that item from the statement alone.","decision":"reject the claim that the current trained blueprint adds downstream value; retain the architecture as an open hypothesis requiring a gating or confidence mechanism and a harder evaluation where the downstream model is not saturated","artifact_sha256":{"statement_only":"32fa548dedbf6eb97df5f8da93406337bbe5f8cfeea715fd63ab874c4a5f3efb","baseline_blueprint":"2078092bf5d3db8773850ca23494ca1f8a7d9aad612a56497cf22a29b130d796","trained_blueprint":"a00d294ad9516a319131f6f4a5438bf9df76791e4f974a170ec58fb112be3435","blind_packet":"5a5bdc2687909b40db651811cfeb9c22fd686e541368d102d8a75ee3d2eed539","blind_key":"0b5dc185e6633a31f6f5001527e4bf761c122baf759ac9247a7a9216dacde427","blind_grades":"48e2ec0d0d1c3520d682c395c6699626b412fc3e83497a7d74e9b49c3fc17538"},"limitation":"This is a natural-language proof-writer proxy, not Lean formalization, and the eight-item statement-only ceiling makes it low power for detecting positive uplift."}
{"iteration":25,"timestamp":"2026-07-19T06:19:53Z","hypothesis":"Scaling diverse high-quality ordinary-language blueprint supervision from 60 to 180 examples will increase viable held-out strategies without sacrificing the numeric incumbent.","change_summary":"combined 120 new non-overlapping teacher-distilled blueprints with the original 60, producing family-disjoint 153/16/11 train/valid/test rows; trained 180 full-parameter AdamW updates from iteration 14 under the corrected RNG-isolated wrapper; evaluated the 90- and 180-step checkpoints on all 60 numeric development problems and a fresh eight-problem blueprint slice never used in earlier grading","command":"uv run python scripts/train_all_parameters.py --model assets/models/qwen3-0.6b-base --initial-weights runs/iter014-traces-cont-adamw-500-seed17/weights.safetensors --data assets/data/processed/training-views/blueprint-pilot-v1-v2-raw --output-dir runs/iter025-blueprint-v1-v2-adamw-180-seed17 --optimizer adamw --batch-size 1 --iters 180 --learning-rate 1e-6 --max-seq-length 1024 --grad-checkpoint --seed 17 --steps-per-report 15 --steps-per-eval 45 --val-batches 16 --save-every 90","result":{"wall_seconds":"approximately 180","peak_metal_gb":6.778,"trained_tokens_180":42627,"fixed_valid_loss_step90":1.479314,"fixed_valid_loss_step180":1.413143,"numeric_step90":{"answers":25,"strict":18,"per_family_strict":{"integer_expression":11,"gcd_bezout":0,"modular_inverse":2,"quadratic_integer_roots":5,"linear_system":0}},"numeric_step180":{"answers":25,"strict":19,"per_family_strict":{"integer_expression":12,"gcd_bezout":0,"modular_inverse":2,"quadratic_integer_roots":5,"linear_system":0}},"fresh_blind_blueprint_mean":{"iteration_14":1.125,"iteration_24":1.375,"step90":1.25,"step180":1.125},"fresh_blind_score_3_or_4_all_models":0,"weights_sha256":{"step90":"b3aceb5b11cbc07e59358a9e8cd4d1fdfb1e11924b672ab4142ff07427df078c","step180":"9f506449f51ea67500def3e482f35e8b746315c60cbaf3aca4ad2abf56d07e50"},"combined_view_manifest_sha256":"f4d22f4208dbfe49aa22342f31acc7576de090e80c2a810a211106931c10dc8b","blind_grades_sha256":{"clean_three_model":"2d58cc4c23c43ee71efa2f85b204040cffe29f47b1c075f11eb7a419c1a9afe8","duration":"68a43be3fff5189de6129059780c7b1efd37f25602cd44e1279ce185c762c05f"}},"baseline":{"iteration_14_numeric_answers":26,"iteration_14_numeric_strict":18,"iteration_24_numeric_answers":25,"iteration_24_numeric_strict":17,"iteration_24_fresh_blind_blueprint_mean":1.375},"decision":"keep final only as a narrow numeric Pareto checkpoint, not as the blueprint leader; retain iteration 24 as strategy leader","failure_mode":"Validation loss improved monotonically and final strict numeric accuracy gained one pass, but blind strategy quality degraded monotonically from iteration 24 through step 90 to step 180, with no viable blueprint. More next-token fit on the scaled curriculum did not produce better mathematical plans.","next_question":"Can gentle sequential training from the iteration-24 strategy leader on only the new examples preserve its behavior better than restarting from the numeric incumbent on the combined corpus?","checkpoint":"retain step 90 only until the duration analysis is recorded, then delete it; retain final temporarily as the strict-numeric leader"}
{"event":"artifact_prune","timestamp":"2026-07-19T06:19:53Z","reason":"the step-180 periodic checkpoint was byte-identical to the retained final weights; an invalid evaluation used literal backslash-n prompt separators and was replaced by an exact corrected rerun","deleted_after_hash_verification":{"runs/iter025-blueprint-v1-v2-adamw-180-seed17/0000180_adapters.safetensors":"9f506449f51ea67500def3e482f35e8b746315c60cbaf3aca4ad2abf56d07e50","runs/iter025-blueprint-v1-v2-adamw-180-seed17/numeric-dev-step90-invalid-literal-newline.jsonl":"discarded noncomparable diagnostic artifact"},"retained":"runs/iter025-blueprint-v1-v2-adamw-180-seed17/weights.safetensors"}
