{"iteration":32,"timestamp":"2026-07-19T08:10:29Z","hypothesis":"A full 300-update completion-masked ordered-plan run will turn the micro diagnostic's content learning into certifiable transfer across five mathematical families.","change_summary":"trained one epoch over all 300 examples, bypassed only Qwen's empty thinking-token transition at inference, evaluated all 50 train-fit and all 80 held-out near-template problems, and compiled Lean certificates for every strict near output","command":"uv run python scripts/train_all_parameters.py --model assets/models/qwen3-0.6b-base --initial-weights runs/iter014-traces-cont-adamw-500-seed17/weights.safetensors --data assets/data/processed/training-views/verified-plan-ladder-ordered-completion --output-dir runs/iter032-vpl-ordered-completion-300-seed17 --optimizer adamw --batch-size 1 --iters 300 --learning-rate 1e-6 --max-seq-length 512 --grad-checkpoint --mask-prompt --seed 17 --steps-per-report 25 --steps-per-eval 100 --val-batches 50 --save-every 300","result":{"validation_loss_start":3.462,"validation_loss_step100":0.968,"validation_loss_step200":0.629,"validation_loss_step300":0.514,"train_loss_step300":0.54,"trained_tokens":32666,"peak_metal_gb":5.555,"train_fit":{"count":50,"parse_rate":0.1,"strict_plan_rate":0.06,"conclusion_accuracy":0.1,"critical_fact_precision":0.259833},"near":{"count":80,"parse_rate":0.0375,"strict_plan_rate":0.025,"conclusion_accuracy":0.0625,"critical_fact_precision":0.194732,"strict_by_family":{"polynomial_value_obstruction":0,"diophantine_solvability":2,"modular_period_prime_filter":0,"finite_double_count":0,"finite_recurrence_period":0}},"lean_near_certificates":2,"weights_sha256":"08268ed77958d873f0bf406a6c5576340f644b9fa4040d8ad7e4566d081c0f17","train_fit_predictions_sha256":"c96dd0a24d6ce1355c814aaeb999d6a219fad2c97357d3cb1e85357ba8d57cc2","near_predictions_sha256":"8b9081fc8bccf63fb5e43392fe54cfd1fbbbe60008bbed36f1a5f4fef10bfdeb","near_details_sha256":"4451b9670daf292558c1da89b237a60e5440bb375a025eea885014ef1c1f4bbc","near_lean_sha256":"576b57ab97ad676cc29e7cae305aeafb08d1640ed0dbc614bd22eecd8e6913eb"},"decision":"retain as first verified-plan checkpoint, but fail promotion gate","failure_mode":"Certifiable held-out transfer exists, but only for 2 of 80 problems and only in the simplest gcd/divisibility family; all other families remain zero.","next_question":"Can focused continued training turn the sole transferring family into a robust specialist, or is it still near chance?"}
{"iteration":33,"timestamp":"2026-07-19T08:10:29Z","hypothesis":"Five additional passes over the 60 Diophantine examples will convert the weak 2-of-16 held-out signal into a reliable one-family specialist.","change_summary":"continued iteration 32 for 300 completion-masked updates on Diophantine rows only and reevaluated all 16 held-out near-template Diophantine problems","command":"uv run python scripts/train_all_parameters.py --model assets/models/qwen3-0.6b-base --initial-weights runs/iter032-vpl-ordered-completion-300-seed17/weights.safetensors --data assets/data/processed/training-views/verified-plan-ladder-ordered-completion-diophantine --output-dir runs/iter033-vpl-diophantine-focus-cont300-seed17 --optimizer adamw --batch-size 1 --iters 300 --learning-rate 1e-6 --max-seq-length 512 --grad-checkpoint --mask-prompt --seed 17 --steps-per-report 25 --steps-per-eval 100 --val-batches 10 --save-every 300","result":{"validation_loss_start":0.452,"validation_loss_step100":0.301,"validation_loss_step200":0.288,"validation_loss_step300":0.284,"train_loss_step300":0.281,"trained_tokens":28025,"peak_metal_gb":5.498,"near_diophantine":{"count":16,"parse_rate":0.5,"conclusion_accuracy":0.5,"strict_plan_rate":0.1875,"critical_fact_precision":0.359375,"required_fact_recall":0.354167},"baseline_iteration32_near_diophantine":{"parse_rate":0.1875,"conclusion_accuracy":0.3125,"strict_plan_rate":0.125,"critical_fact_precision":0.385417},"weights_sha256":"d4d1a645648317c708194870f23e1c97049d5eb62fc31f975016cd1e123d9420","predictions_sha256":"8212d482ce1b73f58be9725b758ea11dfc98fa09abea68f262c0b7554bc3610d","details_sha256":"2fb8cc27c3091f3cad301079164f053c275a5f74a899016215d074303c55adfb"},"decision":"do not scale the exact-proof specialist further","failure_mode":"Specialization improved formatting and conclusions but only added one strict success, plateaued by 100 updates, and reduced fact precision. Half of conclusions remain wrong, consistent with weak gcd/divisibility computation rather than a robust learned method.","next_question":"Can the model reliably choose and state a mathematical method while a fixed executor performs arithmetic instantiation, using hint-free natural-language prompts?"}
{"iteration":34,"timestamp":"2026-07-19T08:40:39Z","hypothesis":"A five-way ordinary-English method-routing objective will be easier for the 0.6B model to acquire and transfer than exact proof plans because arithmetic and formalization are delegated to fixed executors.","change_summary":"trained 100 completion-masked full-parameter updates from iteration 14 on 300 hint-free method-routing examples, evaluated near-template and paraphrase splits, and compared against TF-IDF lexical routing","command":"uv run python scripts/train_all_parameters.py --model assets/models/qwen3-0.6b-base --initial-weights runs/iter014-traces-cont-adamw-500-seed17/weights.safetensors --data assets/data/processed/training-views/method-router-v1 --output-dir runs/iter034-method-router-probe100-seed17 --optimizer adamw --batch-size 1 --iters 100 --learning-rate 1e-6 --max-seq-length 256 --grad-checkpoint --mask-prompt --seed 17 --steps-per-report 10 --steps-per-eval 50 --val-batches 50 --save-every 100","result":{"validation_loss_start":5.355,"validation_loss_step100":1.143,"train_loss_step100":1.201,"trained_tokens":2803,"peak_metal_gb":5.48,"near":{"exact_route":78,"count":80,"rate":0.975,"tfidf_rate":1.0},"paraphrase":{"exact_route":4,"count":80,"rate":0.05,"tfidf_rate":0.8},"weights_sha256":"397029f0eb7e74dce6d5e8a9ab3a364888719fcd86360f514fda6c051e5b00d9","near_predictions_sha256":"0fb5a48d8874958b566b653bf7b2a01cfa6f272f1d45870e03591950d22a5c09","paraphrase_predictions_sha256":"3159ec29944cd983f527bcd5350a0068d65ed466cb50a64c61b8c3d04fd8b97a"},"decision":"continue only as an abstraction diagnostic on more diverse language","failure_mode":"The apparently strong 97.5 percent near score is weaker than a 100 percent TF-IDF baseline, while paraphrase transfer collapses to 5 percent; family nouns and fixed templates make near routing non-evidence for concept learning.","next_question":"Does training on paraphrase and composition language create transferable relation recognition on matched lexical contrast pairs?"}
{"iteration":35,"timestamp":"2026-07-19T08:40:39Z","hypothesis":"Continuing on a 460-example mixture of train, paraphrase, and composition prompts will teach family-invariant English method concepts that survive matched contrast pairs.","change_summary":"continued iteration 34 for 300 completion-masked updates on the diverse mixture; evaluated familiar paraphrase replay, a deterministic 100-prompt and 50-pair contrast set, TF-IDF, raw and calibrated candidate likelihood, and a response-only blind semantic audit","command":"uv run python scripts/train_all_parameters.py --model assets/models/qwen3-0.6b-base --initial-weights runs/iter034-method-router-probe100-seed17/weights.safetensors --data assets/data/processed/training-views/method-router-v1-diverse460 --output-dir runs/iter035-method-router-diverse-cont300-seed17 --optimizer adamw --batch-size 1 --iters 300 --learning-rate 1e-6 --max-seq-length 256 --grad-checkpoint --mask-prompt --seed 17 --steps-per-report 25 --steps-per-eval 100 --val-batches 50 --save-every 300","result":{"validation_loss_start":1.139,"validation_loss_step100":0.871,"validation_loss_step200":0.851,"validation_loss_step300":0.838,"train_loss_step300":0.856,"trained_tokens":8417,"peak_metal_gb":5.48,"paraphrase_training_replay":{"exact_route":47,"count":80,"rate":0.5875},"contrast":{"count":100,"pairs":50,"exact_route":0,"semantic_route":43,"semantic_rate":0.43,"recognizable_route":46,"correct_given_recognizable":0.934783,"both_pair_semantic":9,"pair_rate":0.18,"tfidf_rate":0.59},"candidate_likelihood":{"raw_rate":0.2,"raw_pair_rate":0.0,"all_predictions":"diophantine_solvability","content_free_calibrated_rate":0.32,"content_free_calibrated_pair_rate":0.02,"pre_router_iteration14_content_free_calibrated_rate":0.49,"pre_router_iteration14_pair_rate":0.16},"weights_sha256":"2a0e3f8f1a3414675e7c34ff9b39b69f486dc26c999befe522aec8da61ae83ea","contrast_prompts_sha256":"7235446d98d2e733375cfe2b057c542487c48c5a54c2601ba6f903e0cae1eb22","contrast_predictions_sha256":"976d794f6fe5b114e19690af9c5ccc6141cb743deb62ec7909cde769375a2997","blind_semantic_report_sha256":"fba009ad9b41418ebc9ea10d5ac8ccc84e5d533f841ac10e6e5152c61d2a08c8","content_free_calibration_sha256":"bb5763cad9c0f08e16b22cd1b3b93409086f0884b6ed8bf7647bcad879cba148"},"decision":"reject this method-router continuation as a promotion candidate; retain the checkpoint only until matched negative-control audit is complete","failure_mode":"Diverse training created some high-precision free-English route paraphrases but not broad transfer: 54 percent of outputs remain ambiguous, performance is concentrated in modular and recurrence routes, the 43 percent semantic score trails TF-IDF at 59 percent, and calibrated contrast likelihood is worse than the pre-router checkpoint.","next_question":"Did method-router training improve free-generation semantic routing relative to the iteration-14 numerical checkpoint, or merely shift which route language is emitted?"}
{"event":"artifact_prune","timestamp":"2026-07-19T08:42:00Z","reason":"iteration 34 is an intermediate parent whose exact evaluation artifacts are retained and whose continued descendant iteration 35 is strictly better on familiar method-routing data; disk headroom is required for further matched experiments","deleted_after_hash_verification":{"runs/iter034-method-router-probe100-seed17/weights.safetensors":"397029f0eb7e74dce6d5e8a9ab3a364888719fcd86360f514fda6c051e5b00d9"},"recovery":"retrain iteration 34 from retained iteration 14 using the recorded deterministic command, data view, and seed"}
{"event":"method_router_audit_correction","timestamp":"2026-07-19T08:58:28Z","reason":"the first iteration-35 semantic auditor used public prompts for reference resolution, while the iteration-14 negative control was response-only; a fresh auditor was required for an exact protocol match","iteration35_strict_response_only":{"semantic_correct":18,"count":100,"rate":0.18,"recognizable":18,"correct_given_recognizable":1.0,"both_pair_correct":0,"pairs":50,"report_sha256":"6efb51ffddaa7bf4f48040ad1e2864812ac373f4dac57fe11eb09317c3dd5dd7"},"iteration14_strict_response_only":{"semantic_correct":0,"count":100,"rate":0.0,"recognizable":0,"both_pair_correct":0,"pairs":50,"report_sha256":"30a04d34262085c53dcd125c3906718569a86494b972251211208a8aa1608b39"},"interpretation":"Method-router training created a narrow, high-precision method-emission interface relative to the numerical checkpoint, but coverage is only 18 percent and no matched pair is solved. The earlier 43 percent prompt-assisted figure remains a separate faithful-reference-resolution diagnostic, not the response-only result."}
{"iteration":36,"timestamp":"2026-07-19T08:58:28Z","hypothesis":"A 1:1 completion-masked rehearsal mix of method routing and numerical reasoning can gain readable method emission without erasing the iteration-14 checkpoint's numerical competence.","change_summary":"built a deterministic 920-example natural-language rehearsal view with 460 route and 460 stratified numerical examples, trained 100 full-parameter updates from iteration 14, and evaluated all 60 numerical development problems plus 100 matched route contrasts under a fresh response-only blind audit","command":"uv run python scripts/train_all_parameters.py --model assets/models/qwen3-0.6b-base --initial-weights runs/iter014-traces-cont-adamw-500-seed17/weights.safetensors --data assets/data/processed/training-views/method-router-numeric-rehearsal-v1 --output-dir runs/iter036-method-numeric-rehearsal-probe100-seed17 --optimizer adamw --batch-size 1 --iters 100 --learning-rate 1e-6 --max-seq-length 512 --grad-checkpoint --mask-prompt --seed 17 --steps-per-report 10 --steps-per-eval 50 --val-batches 100 --save-every 100","result":{"validation_loss_start":1.653,"validation_loss_step50":0.898,"validation_loss_step100":0.714,"train_loss_step100":1.194,"trained_tokens":10366,"peak_metal_gb":5.572,"numeric_dev":{"answers":18,"count":60,"strict":15,"baseline_iteration14_answers":26,"baseline_iteration14_strict":18},"contrast_response_only":{"semantic_correct":1,"count":100,"rate":0.01,"recognizable":1,"correct_given_recognizable":1.0,"both_pair_correct":0,"pairs":50},"weights_sha256":"17cd20601160d4de6aa622dc231545e2d02561fbae7462dd1f2d02ca0db58b80","numeric_predictions_sha256":"8635dbcffc8776455c1da7ea58c975778720051d9426d018fb8adaca649d8fa7","numeric_details_sha256":"ad89efbc41bf3d8f6f50216b55b4f95cb6e1485f2b3ab6493ecc0fb29da0219f","contrast_predictions_sha256":"dbbd5cab9ef879ac2230c09bae33976a68baa2274e6ec01d81d154752c9076ba","blind_report_sha256":"198aff35a447e83cb909dec32a2a8947809c9ae6b180bb71e1f36a0358e7681e","training_view_sha256":"1d2619a10ec8267c8082dc5aa862b4e7e29be1043b02d84627533d73b07e0d2d"},"decision":"revert and stop the rehearsal arm at 100 updates","failure_mode":"The mixed objective reduced numerical answer accuracy by eight points out of 60 and strict passes by three while almost entirely collapsing method generation into repeated or corrupted fragments; lower validation loss did not predict either capability.","next_question":"Can a tiny frozen readout expose method concepts already represented by the retained numerical checkpoint without changing its 596 million weights?"}
{"iteration":37,"timestamp":"2026-07-19T08:58:28Z","hypothesis":"A roughly five-thousand-parameter linear readout over frozen Qwen hidden states can recover five mathematical method concepts from natural-language statements while leaving the numerical checkpoint untouched.","change_summary":"extracted last-token and mean-pooled representations from layers 0, 7, 14, 21, and 28 of retained iteration 14; fit ridge heads on 300 labeled route prompts; selected layer, pooling, and ridge on 80 old paraphrases; sealed the selection before opening the 100-prompt matched contrast test; then performed a clearly marked post-hoc oracle layer sweep","command":"uv run python scripts/run_frozen_method_probe.py --model assets/models/qwen3-0.6b-base --weights runs/iter014-traces-cont-adamw-500-seed17/weights.safetensors --train assets/data/processed/training-views/method-router-v1/train.prompts.jsonl --validation assets/data/processed/training-views/method-router-v1/paraphrase.prompts.jsonl --contrast benchmarks/method_router/contrast/data/prompts.jsonl --output-dir runs/iter037-frozen-method-probe-iter014","result":{"selected":{"layer":0,"pool":"mean","ridge":0.01,"train_accuracy":1.0,"paraphrase_accuracy":0.8},"sealed_contrast":{"accuracy":0.2,"both_pair_accuracy":0.0,"count":100,"pairs":50},"posthoc_oracle_not_promotable":{"layer":21,"pool":"mean","ridge":0.1,"paraphrase_accuracy":0.6,"contrast_accuracy":0.7},"tfidf_contrast_accuracy":0.59,"probe_parameters":5120,"probe_bytes":30984,"probe_sha256":"6cb0e0e1fee771f3fe9c14dc95af68a6ffb9b0e3a6c7d702b8db72c66e48962d","selection_seal_sha256":"a001498e0c7dabe02f3b30eb34c29b6092c28968c3060163cc14ce2edd48aaf0","report_sha256":"df0f37b8cde4c537bd647af77712ff3b0b48bbe4b4e9c2f6ea1efbac0a860ba7"},"decision":"reject the paraphrase-selected probe; use the post-hoc layer-21 result only to pre-register one new held-out test","failure_mode":"The old paraphrase split selected a bag-of-token-embedding probe and therefore is not a valid abstraction-selection set; its 80 percent score collapsed to random on matched relations. A deeper hidden layer has a 70 percent post-hoc upper bound, but that number used test labels and cannot be promoted.","next_question":"Does the pre-registered layer-21 mean-pooled ridge-0.1 probe transfer to a newly authored contrast-v2 set with different relation language?"}
{"event":"frozen_probe_preregister","timestamp":"2026-07-19T08:58:28Z","source":"iteration 37 post-hoc contrast-v1 development result","configuration":{"parent_weights":"runs/iter014-traces-cont-adamw-500-seed17/weights.safetensors","layer":21,"pool":"mean","ridge":0.1,"probe_parameters":5120,"probe_bytes":30984},"probe_sha256":"760b0f62d541fda7511926fccaee6ec4576760e50e1d58191fb73e9f3eb8a8aa","selection_seal_sha256":"e5c8f2715e875ae99ff1d53b053120824b611233701eba180e7f18d3790162c3","rationale_sha256":"fc81b2d122a8dbe7e4cd7bbbbc3eec6634fd89e54c4daa4963ba6a1323278f40","evaluation_contract":"Evaluate once on contrast v2 after its deterministic prompts and self-tests are finalized; do not alter layer, pooling, ridge, or training data from the v2 result."}
{"event":"artifact_prune","timestamp":"2026-07-19T08:59:10Z","reason":"iteration 36 failed both predeclared gates and is dominated by retained iteration 14 numerically and iteration 35 on response-only route coverage","deleted_after_hash_verification":{"runs/iter036-method-numeric-rehearsal-probe100-seed17/weights.safetensors":"17cd20601160d4de6aa622dc231545e2d02561fbae7462dd1f2d02ca0db58b80"},"recovery":"retrain from retained iteration 14 using the recorded deterministic command, immutable rehearsal view, and seed"}
{"iteration":38,"timestamp":"2026-07-19T09:05:55Z","hypothesis":"The layer-21 relation signal found post-hoc on contrast v1 will transfer under a pre-registered 5,120-parameter readout to newly authored relation language, and numerical post-training will outperform both base Qwen and lexical routing.","change_summary":"sealed identical layer-21 mean-pooled ridge-0.1 readouts for iteration 14 and untouched base Qwen before contrast-v2 existed; generated and audited contrast v2 with new relation language and zero long-ngram overlap; evaluated each once; ran a frozen TF-IDF baseline and paired tests","command":"uv run python scripts/run_frozen_method_probe.py --model assets/models/qwen3-0.6b-base --weights runs/iter014-traces-cont-adamw-500-seed17/weights.safetensors --train assets/data/processed/training-views/method-router-v1/train.prompts.jsonl --validation assets/data/processed/training-views/method-router-v1/paraphrase.prompts.jsonl --contrast benchmarks/method_router/contrast_v2/data/prompts.jsonl --output-dir runs/iter038-frozen-layer21-probe-sealed --fixed-layer 21 --fixed-pool mean --fixed-ridge 0.1","result":{"contrast_v2":{"count":100,"pairs":50,"prompt_sha256":"e087fa2d070427ac1cb537a7d44ad0831291550558fd131e69f86bb8e8626fdb","manifest_sha256":"4609b65ada1572e94c4e2ea430c030b89d160aa6ef15c522e5b0ecb807f232ef","v1_exact_overlap":0,"v1_normalized_8gram_overlap":0},"iteration14_probe":{"accuracy":0.33,"pair_accuracy":0.06,"per_family_correct":{"polynomial_value_obstruction":10,"diophantine_solvability":0,"modular_period_prime_filter":3,"finite_double_count":0,"finite_recurrence_period":20},"probe_parameters":5120,"probe_bytes":30984,"probe_sha256":"760b0f62d541fda7511926fccaee6ec4576760e50e1d58191fb73e9f3eb8a8aa","selection_seal_sha256":"e5c8f2715e875ae99ff1d53b053120824b611233701eba180e7f18d3790162c3","report_sha256":"3bf6601225aa80cf909c308b774c6f0ca5bebc993f553bdcf6aa6bd7d8b0eefc"},"base_probe":{"accuracy":0.24,"pair_accuracy":0.0,"probe_sha256":"b53d85b31cc30e46a1b27732b28a3547452dc18b7f8ef22c181448b5ebc311a0","selection_seal_sha256":"dac12ea28bec032b9c4335dedf0018ce66e66d64e95274578d1e6ba1a86e69e7","report_sha256":"0d18418bc3c6ab9b56e124c81c0af9611f5c770af0f458a571b899c9a009c789"},"tfidf":{"accuracy":0.18},"iteration14_minus_base":{"difference_pp":9.0,"helped":13,"harmed":4,"exact_mcnemar_two_sided_p":0.049042,"pair_cluster_bootstrap_95pct_pp":[1.0,17.0],"comparison_sha256":"b053044e6f57456171bdb8a3ed86e2c518a203caba678a7da329b36d12e31dbf"},"iteration14_minus_tfidf":{"difference_pp":15.0,"helped":30,"harmed":15,"exact_mcnemar_two_sided_p":0.035698,"pair_cluster_bootstrap_95pct_pp":[4.0,26.0],"comparison_sha256":"17fd78208cc94bf463780a93e22e8566291cc2c20bae6c5fa9c1c1bb24a61bf0"}},"decision":"retain as first positive hidden-concept result, but do not claim broad routing or proof ability","failure_mode":"The post-hoc 70 percent contrast-v1 result shrank to 33 percent on genuinely new language; gains are concentrated in recurrence and polynomial prompts, two families remain at zero, and only three of fifty matched pairs are fully correct.","next_question":"Can training only the 31 KB readout on matched contrast-v1 concepts improve transfer to a third independently worded set without changing the numerical model?"}
