{"change_summary": "created protocol, ledger, conjecture log, and counterexample directory", "command": "init_autoresearch_project.py", "decision": "keep", "failure_mode": null, "hypothesis": "initialize autoresearch workspace", "iteration": 0, "next_question": "fill in objective, metric, evaluation command, and promotion rule", "result": {}, "timestamp": "2026-07-19T02:08:03.612466+00:00"}
{"iteration":1,"timestamp":"2026-07-19T02:35:00Z","hypothesis":"MLX-LM full mode with all transformer layers selected updates every Qwen3-0.6B parameter.","change_summary":"probed stock mlx_lm.lora full mode with --num-layers -1","command":"uv run mlx_lm.lora --model assets/models/qwen3-0.6b-base --train --data experiments/full_train_probe --fine-tune-type full --num-layers -1 --optimizer adafactor --batch-size 1 --iters 3 --max-seq-length 256 --grad-checkpoint --seed 17","result":{"trainable_parameters":440466000,"total_parameters":596050000,"trainable_percent":73.898,"peak_metal_gb":2.529},"baseline":{},"decision":"revert","failure_mode":"Stock full mode freezes embeddings, final normalization, and language-model head, violating literal full-parameter training.","next_question":"Can a wrapper unfreeze and audibly count all parameters?","checkpoint":"discarded after log preservation"}
{"iteration":2,"timestamp":"2026-07-19T02:38:00Z","hypothesis":"Literal 100% parameter training is feasible in 16 GB unified memory.","change_summary":"added train_all_parameters.py and ran a three-update 256-cap probe","command":"uv run python scripts/train_all_parameters.py --model assets/models/qwen3-0.6b-base --data experiments/full_train_probe --output-dir experiments/full_train_probe/output-all-seq256-seed17 --optimizer adafactor --batch-size 1 --iters 3 --learning-rate 1e-5 --max-seq-length 256 --grad-checkpoint --seed 17","result":{"trainable_parameters":596049920,"trainable_percent":100.0,"peak_metal_gb":3.318,"wall_seconds":5.82},"baseline":{"stock_full_trainable_percent":73.898},"decision":"keep","failure_mode":null,"next_question":"How do memory and time scale on realistic completion-only examples?","checkpoint":"discarded after log and run config preservation"}
{"iteration":3,"timestamp":"2026-07-19T02:43:00Z","hypothesis":"A 512-token context is safe for literal full-parameter training and fast enough for many development updates.","change_summary":"ran a three-update candidate-derived 512-cap completion-only probe","command":"uv run python scripts/train_all_parameters.py --model assets/models/qwen3-0.6b-base --data experiments/full_train_probe/realistic/tokens-512 --output-dir experiments/full_train_probe/output-all-real512-seed17 --optimizer adafactor --batch-size 1 --iters 3 --learning-rate 1e-5 --max-seq-length 512 --grad-checkpoint --mask-prompt --seed 17","result":{"trainable_parameters":596049920,"peak_metal_gb":3.414,"iteration_rate_range":[0.339,0.383],"wall_seconds":14.21},"baseline":{"context_cap":256,"peak_metal_gb":3.318},"decision":"keep","failure_mode":"Candidate-derived prompt/completion formatting added about 14 tokens beyond the probe builder's concatenated length estimate, causing small boundary truncations.","next_question":"Does 1024 remain comfortably within memory and improve untruncated data coverage enough to repay its time cost?","checkpoint":"discarded after log and run config preservation"}
{"iteration":4,"timestamp":"2026-07-19T02:47:00Z","hypothesis":"A 1024-token context remains memory-safe and approximately doubles update time relative to 512.","change_summary":"ran a three-update candidate-derived 1024-cap completion-only probe","command":"uv run python scripts/train_all_parameters.py --model assets/models/qwen3-0.6b-base --data experiments/full_train_probe/realistic/tokens-1024 --output-dir experiments/full_train_probe/output-all-real1024-seed17 --optimizer adafactor --batch-size 1 --iters 3 --learning-rate 1e-5 --max-seq-length 1024 --grad-checkpoint --mask-prompt --seed 17","result":{"trainable_parameters":596049920,"peak_metal_gb":3.647,"iteration_rate_range":[0.177,0.196],"wall_seconds":21.74},"baseline":{"context_cap":512,"peak_metal_gb":3.414,"iteration_rate_range":[0.339,0.383]},"decision":"keep","failure_mode":null,"next_question":"Is 1536 still memory-safe, and should context be selected by validation gain per wall-hour rather than memory?","checkpoint":"discarded after log and run config preservation"}
{"iteration":5,"timestamp":"2026-07-19T02:51:00Z","hypothesis":"A 1536-token context is memory-safe but materially reduces the number of full-model updates available overnight.","change_summary":"ran a three-update candidate-derived 1536-cap completion-only probe","command":"uv run python scripts/train_all_parameters.py --model assets/models/qwen3-0.6b-base --data experiments/full_train_probe/realistic/tokens-1536 --output-dir experiments/full_train_probe/output-all-real1536-seed17 --optimizer adafactor --batch-size 1 --iters 3 --learning-rate 1e-5 --max-seq-length 1536 --grad-checkpoint --mask-prompt --seed 17","result":{"trainable_parameters":596049920,"peak_metal_gb":3.907,"iteration_rate_range":[0.115,0.12],"wall_seconds":33.0},"baseline":{"context_cap":1024,"peak_metal_gb":3.647,"iteration_rate_range":[0.177,0.196]},"decision":"keep","failure_mode":null,"next_question":"After compact blueprints are prepared, which context gives the best family-held-out validation gain per wall-hour?","checkpoint":"discarded after log and run config preservation"}
{"iteration":6,"timestamp":"2026-07-19T03:00:00Z","hypothesis":"One hundred full-weight updates on disjoint synthetic concept-and-reasoning examples will improve exact development-set mathematics as well as completion loss and format validity.","change_summary":"trained all 596.050M parameters for 100 updates at 1e-5 on 300 synthetic natural-language examples across five deterministic families","command":"uv run python scripts/train_all_parameters.py --model assets/models/qwen3-0.6b-base --data assets/data/processed/synthetic-dnl-v1 --output-dir runs/iter006-synthetic-100-seed17 --optimizer adafactor --batch-size 1 --iters 100 --learning-rate 1e-5 --max-seq-length 512 --grad-checkpoint --mask-prompt --seed 17 --steps-per-report 10 --steps-per-eval 25 --val-batches 10 --save-every 100","result":{"wall_seconds":65.45,"peak_metal_gb":3.318,"trained_tokens":8046,"full_validation_loss_base":2.685274,"full_validation_loss_candidate":0.303067,"dev_answer_accuracy_base":0.133333,"dev_answer_accuracy_candidate":0.033333,"dev_strict_pass_base":0.116667,"dev_strict_pass_candidate":0.033333,"dev_format_valid_base":0.4,"dev_format_valid_candidate":0.983333,"weights_sha256":"ba99384d0dab022361e55da4c4eb27d4a47dcb069a1cd27d6af017eb95e770bd"},"baseline":{"model":"untouched Qwen3-0.6B-Base","dev_instances":60},"decision":"revert","failure_mode":"The model learned response templates and repeated memorized numeric fragments while exact mathematical correctness collapsed; completion loss and parse rate were anti-correlated with the desired behavior.","next_question":"Can a much lower full-model learning rate improve schema adherence without overwriting pretrained arithmetic, and should exact deterministic correctness become a mandatory local promotion gate?","checkpoint":"discard after preserving log, run config, predictions, metrics, and hash"}
{"iteration":7,"timestamp":"2026-07-19T03:09:00Z","hypothesis":"Reducing the all-parameter Adafactor learning rate tenfold to 1e-6 will preserve pretrained arithmetic while still learning natural-language reasoning format.","change_summary":"repeated the 100-update synthetic run at 1e-6 with identical seed, data, decoding, and full-parameter contract","command":"uv run python scripts/train_all_parameters.py --model assets/models/qwen3-0.6b-base --data assets/data/processed/synthetic-dnl-v1 --output-dir runs/iter007-synthetic-lr1e6-100-seed17 --optimizer adafactor --batch-size 1 --iters 100 --learning-rate 1e-6 --max-seq-length 512 --grad-checkpoint --mask-prompt --seed 17 --steps-per-report 20 --steps-per-eval 25 --val-batches 10 --save-every 1000","result":{"wall_seconds":63.77,"peak_metal_gb":3.318,"trained_tokens":8046,"sampled_validation_loss_final":0.790,"dev_answer_accuracy":0.0,"dev_strict_pass":0.0,"dev_format_valid":0.0,"weights_sha256":"6fce99a7b56466072f73ad5ccc46e1bbbac5a09d6db94c7d2bc9113cea6af459"},"baseline":{"dev_answer_accuracy":0.133333,"dev_strict_pass":0.116667},"decision":"revert","failure_mode":"Tenfold lower Adafactor learning rate still produced severe numeric mode collapse, repeatedly emitting a memorized answer fragment such as 5 plus Reasoning instead of conditioning on the operands.","next_question":"Is the instability specific to Adafactor/all-module updates, and can AdamW at a low rate or a retention mixture avoid mode collapse?","checkpoint":"discard after preserving log, run config, predictions, metrics, and hash"}
{"iteration":8,"timestamp":"2026-07-19T03:16:00Z","hypothesis":"Literal all-parameter AdamW is memory-feasible on the 16 GB M4 and may avoid Adafactor's rapid numeric mode collapse.","change_summary":"ran a three-update AdamW memory and machinery probe at 1e-6 on the same synthetic data","command":"uv run python scripts/train_all_parameters.py --model assets/models/qwen3-0.6b-base --data assets/data/processed/synthetic-dnl-v1 --output-dir runs/iter008-adamw-probe --optimizer adamw --batch-size 1 --iters 3 --learning-rate 1e-6 --max-seq-length 512 --grad-checkpoint --mask-prompt --seed 17 --steps-per-report 1 --steps-per-eval 1000 --val-batches 2 --save-every 1000","result":{"wall_seconds":4.30,"peak_metal_gb":5.385,"trained_tokens":232,"sampled_validation_loss_start":2.746,"sampled_validation_loss_end":2.425},"baseline":{"adafactor_peak_metal_gb":3.318},"decision":"keep","failure_mode":null,"next_question":"Does a short AdamW learning run preserve or improve exact development correctness?","checkpoint":"discard after preserving log and run config"}
{"iteration":9,"timestamp":"2026-07-19T03:21:00Z","hypothesis":"Fifty low-rate AdamW updates will learn supervised reasoning format without the Adafactor numeric collapse.","change_summary":"trained all parameters for 50 completion-only AdamW updates at 1e-6 and applied the deterministic arithmetic early-stop gate","command":"uv run python scripts/train_all_parameters.py --model assets/models/qwen3-0.6b-base --data assets/data/processed/synthetic-dnl-v1 --output-dir runs/iter009-adamw-lr1e6-50-seed17 --optimizer adamw --batch-size 1 --iters 50 --learning-rate 1e-6 --max-seq-length 512 --grad-checkpoint --mask-prompt --seed 17 --steps-per-report 10 --steps-per-eval 10 --val-batches 10 --save-every 1000","result":{"wall_seconds":29.70,"peak_metal_gb":5.517,"trained_tokens":3976,"sampled_validation_loss_start":2.686,"sampled_validation_loss_end":1.286,"integer_expression_answer_accuracy_base":0.583333,"integer_expression_answer_accuracy_candidate":0.083333,"integer_expression_format_valid_candidate":1.0,"weights_sha256":"8a0edc05da1d344d75c0fa9b5c343967e7f880238a203b148b720f625253af6f"},"baseline":{"integer_expression_dev_instances":12},"decision":"revert","failure_mode":"AdamW reduced loss smoothly but still optimized repetitive completion form at the expense of operand-conditioned arithmetic; the early correctness gate stopped the remaining 48-instance evaluation.","next_question":"Does including prompt tokens in the loss act as a retention/rehearsal term during literal full-weight training?","checkpoint":"discard after preserving log, partial predictions, metrics, and hash"}
{"iteration":10,"timestamp":"2026-07-19T03:34:00Z","hypothesis":"Including prompt tokens in low-rate AdamW loss will improve conditioning and retention relative to completion-only training.","change_summary":"trained 50 all-parameter AdamW updates without prompt masking, discovered and corrected a raw-versus-chat inference mismatch, then evaluated all 60 development instances with the same Qwen chat template used by MLX training","command":"uv run python scripts/train_all_parameters.py --model assets/models/qwen3-0.6b-base --data assets/data/processed/synthetic-dnl-v1 --output-dir runs/iter010-adamw-unmasked-50-seed17 --optimizer adamw --batch-size 1 --iters 50 --learning-rate 1e-6 --max-seq-length 512 --grad-checkpoint --seed 17 --steps-per-report 10 --steps-per-eval 10 --val-batches 10 --save-every 1000","result":{"wall_seconds":29.38,"peak_metal_gb":5.517,"trained_tokens":7292,"sampled_validation_loss_start":3.014,"sampled_validation_loss_end":1.578,"dev_official_answer_accuracy":0.15,"dev_official_strict_pass":0.083333,"dev_official_format_valid":0.266667,"integer_expression_semantic_answer_phrase_accuracy":0.916667,"integer_expression_official_accuracy":0.333333,"quadratic_official_accuracy":0.416667,"weights_sha256":"9c41ce13b488ebea579ff6bf47d5c693c3b5f8ad3440c67a357beaa956540c59"},"baseline":{"raw_base_dev_answer_accuracy":0.133333,"raw_base_dev_strict_pass":0.116667,"chat_base_is_not_a_usable_instruction_baseline":true},"decision":"keep","failure_mode":"Language and transport instability hide some correct arithmetic: many outputs are correct natural-language Chinese but violate the requested English final form; gcd, modular inverse, and linear-system generations often degenerate. Iterations 6, 7, and 9 were evaluated through the wrong raw interface, so their mode-collapse conclusions are superseded and their deleted checkpoints would require exact reruns for a fair chat evaluation.","next_question":"Does completion-only Adafactor, previously rejected under the wrong raw interface, outperform this provisional checkpoint when evaluated with the exact training chat template?","checkpoint":"retain as provisional local leader"}
{"iteration":11,"timestamp":"2026-07-19T03:43:00Z","hypothesis":"The 100-update completion-only Adafactor recipe rejected under raw decoding will outperform the provisional AdamW checkpoint under its correct chat interface.","change_summary":"exactly reran the 100-update masked Adafactor recipe from base and applied a 12-instance arithmetic early gate using chat-template inference","command":"uv run python scripts/train_all_parameters.py --model assets/models/qwen3-0.6b-base --data assets/data/processed/synthetic-dnl-v1 --output-dir runs/iter011-adafactor-masked-100-seed17 --optimizer adafactor --batch-size 1 --iters 100 --learning-rate 1e-5 --max-seq-length 512 --grad-checkpoint --mask-prompt --seed 17 --steps-per-report 20 --steps-per-eval 25 --val-batches 10 --save-every 1000","result":{"wall_seconds":61.44,"peak_metal_gb":3.318,"trained_tokens":8046,"sampled_validation_loss_final":0.272,"integer_expression_official_accuracy":0.0,"integer_expression_format_valid":1.0,"weights_sha256":"31ef456c0968e52499253429ad9fa3272aa186a2c1268b0a7e32deba482f57de"},"baseline":{"provisional_leader_integer_expression_official_accuracy":0.333333,"provisional_leader_semantic_accuracy":0.916667},"decision":"revert","failure_mode":"Correct-interface generations confirm numeric mode collapse: fluent English templates repeatedly assert 5 or 25 while changing the operands. Loss is again anti-correlated with mathematics.","next_question":"Can much broader parameter coverage and a clean English chat prompt prevent unconditional numeric-template learning under AdamW?","checkpoint":"discard after preserving log, partial predictions, metrics, and hash"}
{"iteration":12,"timestamp":"2026-07-19T03:55:00Z","hypothesis":"A 2,500-example broad English-only chat curriculum will prevent tiny-range memorization and improve all five deterministic families.","change_summary":"generated 2,500/250/250 disjoint expanded examples and trained 500 unmasked all-parameter AdamW updates, preserving 250- and 500-step checkpoints","command":"uv run python scripts/train_all_parameters.py --model assets/models/qwen3-0.6b-base --data assets/data/processed/synthetic-dnl-v2-expanded --output-dir runs/iter012-expanded-adamw-500-seed17 --optimizer adamw --batch-size 1 --iters 500 --learning-rate 1e-6 --max-seq-length 512 --grad-checkpoint --seed 17 --steps-per-report 50 --steps-per-eval 100 --val-batches 25 --save-every 250","result":{"wall_seconds":295.76,"peak_metal_gb":6.709,"trained_tokens":81869,"sampled_validation_loss_start":2.881,"sampled_validation_loss_250_approx":0.7,"sampled_validation_loss_500":0.566,"integer_expression_accuracy_250":0.0,"integer_expression_accuracy_500":0.166667,"format_valid_250":0.25,"format_valid_500":0.5,"weights_250_sha256":"911c74644e80a4a60ae026ebaf83eda9a1f7777f4112b51b8affae8fecd71c9e","weights_500_sha256":"40327bffd8a1e9d6e4e9a28e6e165ed8df9844ced768216256a152d92d1a66d8"},"baseline":{"provisional_leader_integer_expression_official_accuracy":0.333333,"provisional_leader_semantic_accuracy":0.916667},"decision":"revert","failure_mode":"Broader coverage reduced tiny-number mode collapse and improved from step 250 to 500, but the checkpoint remained below the incumbent and produced chat-specific symbol/language artifacts. Continuing the same chat trajectory was not justified before testing a raw causal-text interface aligned with the base model.","next_question":"Can raw text post-training retain the base model's arithmetic while learning the same English reasoning targets without spending capacity on chat-template behavior?","checkpoint":"discard 250 and 500 after preserving logs, configs, predictions, metrics, and hashes"}
{"iteration":13,"timestamp":"2026-07-19T04:15:00Z","hypothesis":"Raw causal-text post-training will retain the base model's arithmetic while learning natural-language reasoning and additional algorithmic families more efficiently than chat-formatted training.","change_summary":"converted the same 2,500/250/250 expanded curriculum to raw causal text, trained all parameters for 500 AdamW updates, evaluated the 250- and 500-step arithmetic gates, and completed a matched full-development comparison against the untouched base model","command":"uv run python scripts/train_all_parameters.py --model assets/models/qwen3-0.6b-base --data assets/data/processed/synthetic-dnl-v2-expanded-raw --output-dir runs/iter013-raw-expanded-adamw-500-seed17 --optimizer adamw --batch-size 1 --iters 500 --learning-rate 1e-6 --max-seq-length 512 --grad-checkpoint --seed 17 --steps-per-report 50 --steps-per-eval 100 --val-batches 25 --save-every 250","result":{"wall_seconds":292.35,"peak_metal_gb":6.709,"trained_tokens":76369,"sampled_validation_loss_start":2.203,"sampled_validation_loss_100":0.671,"sampled_validation_loss_200":0.491,"sampled_validation_loss_300":0.428,"sampled_validation_loss_400":0.355,"sampled_validation_loss_500":0.329,"integer_expression_accuracy_250":0.583333,"integer_expression_accuracy_500":0.833333,"dev_answer_accuracy":0.366667,"dev_strict_pass":0.216667,"dev_format_valid":0.85,"dev_per_family_answers":{"integer_expression":10,"gcd_bezout":9,"modular_inverse":1,"quadratic_integer_roots":2,"linear_system":0},"dev_per_family_strict":{"integer_expression":10,"gcd_bezout":0,"modular_inverse":1,"quadratic_integer_roots":2,"linear_system":0},"weights_250_sha256":"257bf7a37fe09648d63f96cfd55a3019ac92e6ab900cd9e97bf9563e20ea3ca4","weights_500_sha256":"f013f7112ae21e2a1ab40c8b077d4397d9ddd926f97cdddb9b47eee4a7643f4b"},"baseline":{"raw_base_dev_answer_accuracy":0.15,"raw_base_dev_strict_pass":0.0,"raw_base_dev_format_valid":0.2,"raw_base_per_family_answers":{"integer_expression":9,"gcd_bezout":0,"modular_inverse":0,"quadratic_integer_roots":0,"linear_system":0}},"decision":"keep","failure_mode":"The improvement is broad enough to exceed formatting alone, especially 0/12 to 9/12 on gcd values, but algorithmic certificates remain nearly absent and linear systems remain at 0/12. The next experiment should target reasoning traces and certificate correctness rather than merely extend an undifferentiated loss curve.","next_question":"Can explicit, verifier-valid step traces for Euclid, extended Euclid, substitution, and factorization convert answer-only gains into certificate-valid reasoning without sacrificing arithmetic?","checkpoint":"retain final as the incumbent; remove the byte-identical numbered final copy and retain step 250 only until dominance is fully recorded"}
