{"event":"frozen_probe_preregister","timestamp":"2026-07-19T09:05:55Z","source":"iteration 38 positive but weak held-out result; contrast v1 is development data and contrast v2 is not used for fitting","training_view":{"count":400,"sources":["method-router original train 300","contrast-v1 development 100"],"sha256":"d533696fdc3fc48c7e9516c691185b1cc638922a49c6df5a17aea35b7e5e3d2a"},"configuration":{"layer":21,"pool":"mean","ridge":0.1,"probe_parameters":5120,"probe_bytes":30984},"iteration14":{"probe_sha256":"d729c596f2c209f1f8df7adb7e592cda8de9571915a481b9d73bbd69af89efd7","selection_seal_sha256":"13ea9855a72984849590bb24a12499c5dc79b17be3cc8df3cac12e60b3394490"},"base":{"probe_sha256":"bdaae51db013fa520ef6ef516fd6deae303275ae59d327bf9b7fade1dcba2795","selection_seal_sha256":"64f1c5021752551cc7bb2bdd15028cfbf860063c27c5cbc1295f6d517860c084"},"evaluation_contract":"Evaluate both once on newly authored contrast v3 after its prompts pass zero-overlap audits against v1 and v2; compare against TF-IDF trained on the identical 400 prompts; do not alter configuration from v3 results."}
{"iteration":39,"timestamp":"2026-07-19T09:15:03Z","hypothesis":"Training only the sealed 5,120-parameter layer-21 readout on 100 matched contrast-v1 examples will produce robust method routing on third-generation language while preserving the underlying model; numerical post-training should remain beneficial if it truly encoded the concepts.","change_summary":"fit identical frozen heads on base Qwen and iteration 14 using original route train plus contrast-v1 development data; sealed both before contrast v3 existed; audited v3 for zero prompt and normalized eight-token overlap against v1 and v2; evaluated both once with a no-refit evaluator; compared against TF-IDF trained on identical 400 prompts","command":"uv run python scripts/evaluate_frozen_method_probe.py --model assets/models/qwen3-0.6b-base --probe runs/iter039b-frozen-layer21-contrast-trained-base-sealed/probe.npz --expected-probe-sha256 bdaae51db013fa520ef6ef516fd6deae303275ae59d327bf9b7fade1dcba2795 --prompts benchmarks/method_router/contrast_v3/data/prompts.jsonl --predictions runs/iter039b-frozen-layer21-contrast-trained-base-sealed/contrast-v3-predictions.jsonl --report runs/iter039b-frozen-layer21-contrast-trained-base-sealed/contrast-v3-report.json","result":{"contrast_v3":{"count":100,"pairs":50,"prompt_sha256":"74c5cf839fc92836aefa8520cc47058d25b2d42d9b349d8b0f2e7cabcf08f066","manifest_sha256":"3c9559c3d53de708e43f9f58d1d1fd2ff03983ff454806ecc8145578a42b251c","prior_exact_overlap":{"v1":0,"v2":0},"prior_normalized_8gram_overlap":{"v1":0,"v2":0}},"base":{"accuracy":0.98,"pair_accuracy":0.96,"peak_metal_gb":1.4533,"prompts_per_second_including_load":12.9165,"probe_sha256":"bdaae51db013fa520ef6ef516fd6deae303275ae59d327bf9b7fade1dcba2795","predictions_sha256":"f6470994c82ca8d362910f91032d5da588c8d76a73f7d5de005f9008f81149fd","report_sha256":"32146f1428a18c6a68909b589333595c6d5feaeba79f4abcf78303ddd7e61bcb"},"iteration14":{"accuracy":0.87,"pair_accuracy":0.74,"peak_metal_gb":1.233,"prompts_per_second_including_load":10.5343,"probe_sha256":"d729c596f2c209f1f8df7adb7e592cda8de9571915a481b9d73bbd69af89efd7","predictions_sha256":"96167d8148b82e386704413c2ad000e5d0d7ef1c8c8be620215678a42910856e","report_sha256":"63748f300594c56ab7b0bffd17e267414a91688af76f7b9d1f9499a2056a9767"},"tfidf":{"accuracy":0.2},"iteration14_minus_base":{"difference_pp":-11.0,"helped":1,"harmed":12,"exact_mcnemar_two_sided_p":0.003418,"pair_cluster_bootstrap_95pct_pp":[-17.0,-5.0],"comparison_sha256":"94d00c521120e6c44d74858911b98faf7c551e68f0280e2c0d74d5325769d880"},"iteration14_minus_tfidf":{"difference_pp":67.0,"exact_mcnemar_two_sided_p":1.36e-20,"pair_cluster_bootstrap_95pct_pp":[59.0,75.0],"comparison_sha256":"b2aee808a54e572c6b4480f7e3cf4966042cb07a69d0ff9625441575f66e154c"}},"decision":"promote base Qwen plus the 31 KB frozen readout as the routing prototype; reject the numerical checkpoint as its router backbone","failure_mode":"The hypothesis that numerical post-training encoded better route concepts is falsified: it significantly harms the same sealed head relative to base. High routing accuracy still covers only five synthetic method families and does not show method execution or proof generation.","next_question":"Can the promoted base router safely dispatch natural-language statements to fixed mathematical executors whose results are independently verified and compiled by Lean?"}
{"iteration":40,"timestamp":"2026-07-19T09:15:03Z","hypothesis":"The promoted base router can serve as the compact idea selector in a natural-language-only pipeline: correct predicted routes can dispatch to fixed parsers and mathematical executors, and Lean can certify their complete derived claims.","change_summary":"evaluated the sealed base readout on all 80 verified-plan composition statements; before private facts were opened, dispatched each public statement using only its predicted route, parsed its numbers, recomputed every critical fact and witness, and sealed English responses; then ran the strict private verifier, emitted Lean certificates from parsed claims, and compiled them","command":"uv run python scripts/run_fixed_routed_executor.py --prompts benchmarks/verified_plan_ladder/data/composition.prompts.jsonl --route-predictions runs/iter039b-frozen-layer21-contrast-trained-base-sealed/composition-route-predictions.jsonl --private benchmarks/verified_plan_ladder/data/composition.verifier.jsonl --targets benchmarks/verified_plan_ladder/data/composition.targets.jsonl --responses runs/iter040-base-router-fixed-executor/composition-responses.jsonl --seal runs/iter040-base-router-fixed-executor/execution-seal.json --details runs/iter040-base-router-fixed-executor/composition-details.jsonl --report runs/iter040-base-router-fixed-executor/report.json","result":{"router":{"correct":80,"count":80,"accuracy":1.0,"peak_metal_gb":1.3356,"prompts_per_second_including_load":17.8782,"predictions_sha256":"a8ba832d8d6216d81d157c884d3e62317bdc1e86e3eb078fd74fd7d10d4da30b"},"executor":{"route_parse_failures":0,"strict":80,"count":80,"strict_rate":1.0,"responses_sha256":"9e7c67749ad73a9308e4495f9863bd0f4417a1b0e67216ed4c04746ea20fe920","execution_seal_sha256":"9481306fa8f3aa7cf8a5dfc4def3c7e92ee0d6fab0a3e0f350c67a2bccc8e263","details_sha256":"531895524ebbc8095cf016038b4213c3645580e2b0844fe0c707aa958148caa4","report_sha256":"d40bad7cc439460503f14b66070d82cd0b3cc2ad6d87b4d35716b0b9d095b06d"},"lean":{"certificates":80,"compile":"pass","certificate_sha256":"f340a11875e675ba9eb86f63e0dd20a8c5862f099b837a70c695ccda53897da1"}},"decision":"retain as the first complete compact-router plus fixed-executor plus Lean prototype","failure_mode":"This does not demonstrate autonomous reasoning by the 0.6B model: the model selects one of five methods, while handwritten parsers and executors perform all arithmetic and proof construction. The composition templates are easier to route than the matched contrast suites.","next_question":"Can the compact model contribute a useful nontrivial argument beyond route selection while a faithful external system formalizes it, without catastrophic forgetting or unverifiable claim repair?"}
{"iteration":41,"timestamp":"2026-07-19T09:28:35Z","hypothesis":"The untouched 0.6B base checkpoint may already contain useful informal mathematical arguments that the numerical post-training obscured, especially when prompted through its tokenizer contract.","change_summary":"ran a chat-template preflight that collapsed into repeated Unicode tokens, diagnosed that the local asset is Qwen3-0.6B-Base rather than an instruction checkpoint, then reran five balanced paraphrase problems as raw language-model continuations","command":"uv run python scripts/run_plan_ladder.py --model assets/models/qwen3-0.6b-base --prompts runs/iter041-base-informal-arguments/paraphrase-balanced-10.prompts.jsonl --output runs/iter041-base-informal-arguments/plain-raw.predictions.jsonl --max-tokens 256 --temperature 0 --seed 17 --limit 5","result":{"chat_preflight":{"completed":4,"failure":"repeated Unicode-token collapse"},"raw_balanced5":{"count":5,"parse_rate":0.0,"strict_plan_rate":0.0,"critical_fact_precision":0.0,"conclusion_accuracy":0.0,"predictions_sha256":"209c55880070a00f5eccda2ffa350946b0599f27c650946d01dad6f7d0c05504","report_sha256":"580e2e57001a3a7e1e466fa1ab1aa58262671f9ac6b41afdfcaed9096054597f"}},"decision":"reject untouched base generation as an argument baseline","failure_mode":"Raw continuation produced recognizable but repetitive or incomplete plans and no verified mathematical argument; the chat wrapper is categorically invalid for this base checkpoint.","next_question":"Can completion-only post-training work if prompt and answer are tokenized directly, avoiding the Qwen chat/thinking transitions that prior diagnostics showed the model never learned?"}
{"iteration":42,"timestamp":"2026-07-19T09:28:35Z","hypothesis":"Direct raw prompt-completion tokenization with completion-only loss will remove the special-token exposure failure and let the 0.6B base model learn verified plans.","change_summary":"added an audited raw-completions dataset path, confirmed the answer begins exactly at token offset 51 on a 147-token example, then started a full-parameter Adafactor run with a step-50 validation gate","command":"uv run python scripts/train_all_parameters.py --model assets/models/qwen3-0.6b-base --data assets/data/processed/training-views/verified-plan-ladder-ordered-completion --output-dir runs/iter042-base-raw-completion-100-seed17 --optimizer adafactor --iters 100 --learning-rate 1e-5 --mask-prompt --raw-completions --seed 17","result":{"token_preflight":{"total_tokens":147,"prompt_offset":51,"completion_boundary":"First, The input difference is -8"},"training":{"validation_loss_step1":3.047,"validation_loss_step50":5.232,"train_loss_step25":8.847,"train_loss_step50":4.936,"peak_metal_gb":3.322,"stopped_at_step":50,"checkpoint_saved":false}},"decision":"kill at the validation gate","failure_mode":"The representation was valid, but this Adafactor setting immediately destabilized the base checkpoint and more than doubled held-out loss.","next_question":"Does a conventional AdamW update at one tenth the learning rate improve held-out raw-completion loss without destabilization?"}
{"iteration":43,"timestamp":"2026-07-19T09:28:35Z","hypothesis":"Twenty-five full-parameter AdamW updates at 1e-6 will establish whether direct completion-only plan learning has a stable optimization regime.","change_summary":"trained from untouched base for 25 updates with the raw completion-only representation, evaluated held-out loss, then generated a balanced ten-problem paraphrase preflight","command":"uv run python scripts/train_all_parameters.py --model assets/models/qwen3-0.6b-base --data assets/data/processed/training-views/verified-plan-ladder-ordered-completion --output-dir runs/iter043-base-raw-completion-adamw25-seed17 --optimizer adamw --iters 25 --learning-rate 1e-6 --mask-prompt --raw-completions --seed 17","result":{"training":{"validation_loss_step1":3.073,"validation_loss_step25":2.045,"train_loss_step25":2.184,"trained_tokens":2590,"peak_metal_gb":5.517},"paraphrase_balanced10":{"count":10,"parse_rate":0.0,"strict_plan_rate":0.0,"critical_fact_precision":0.0,"predictions_sha256":"42b5cbf0405d938da2472b5909df526d4989cb73fcb060074669e65f613a2a7f","report_sha256":"620b36069cf64969ff1541482a9a070fbd2050594050858ed194fbaa0bf6ac91"},"weights_sha256":"f0457b1a76143a15d517f5fbe5c69edc2447eb4b648bb0d5b0725ca6490aa57e"},"decision":"continue to 100 total updates because held-out loss improved, while withholding capability promotion","failure_mode":"The optimizer is stable, but 25-step generation still loops, fabricates arithmetic, and produces no certifiable argument.","next_question":"Does continuing the same stable regime to 100 total updates translate the improving held-out loss into any verified near-template or paraphrase argument?"}
{"iteration":44,"timestamp":"2026-07-19T09:28:35Z","hypothesis":"One hundred total stable raw-completion updates will convert strong held-out likelihood learning into at least two verified arguments on a balanced 25-problem audit.","change_summary":"continued the step-25 checkpoint for 75 AdamW updates, then ran separate balanced 25-problem audits on paraphrase and near-template splits with strict family-specific verification","command":"uv run python scripts/train_all_parameters.py --model assets/models/qwen3-0.6b-base --initial-weights runs/iter043-base-raw-completion-adamw25-seed17/weights.safetensors --data assets/data/processed/training-views/verified-plan-ladder-ordered-completion --output-dir runs/iter044-base-raw-completion-adamw100-seed17 --optimizer adamw --iters 75 --learning-rate 1e-6 --mask-prompt --raw-completions --seed 17","result":{"training":{"validation_loss_start":2.004,"validation_loss_end":0.639,"train_loss_end":0.735,"continuation_tokens":7933,"peak_metal_gb":5.536},"paraphrase_balanced25":{"count":25,"parse_rate":0.0,"strict_plan_rate":0.0,"critical_fact_precision":0.0,"conclusion_accuracy":0.0,"predictions_sha256":"13307d148636c96d616b365a37870a98dfed326baddfc9af890163fb8aa8be04","report_sha256":"776eec0feda2f6ca54fa63175479ae1243ae8c742da79233fb5bdd1aac3c66b0"},"near_balanced25":{"count":25,"parse_rate":0.0,"strict_plan_rate":0.0,"critical_fact_precision":0.08,"required_fact_recall":0.018,"conclusion_accuracy":0.04,"predictions_sha256":"006e12e9e5b04f022b4240718870adefc345424a15681e9442e535c07e5524f7","report_sha256":"aaea3a8f36624bc4a0c7103e1b2359b5aded60fdd8ff82316a0f1054821283c"},"weights_sha256":"c4d6ce5aa77bcb17b52f085e30e6dde4b4e33c9c43abb5c48d54771d0d0e93d5"},"decision":"reject and prune the checkpoint; retain the raw-completion implementation and negative result","failure_mode":"The interface failure was fixed and held-out loss fell 79 percent, yet no audited response was certifiable. The model learned the surface distribution while continuing to invent facts, skip arithmetic, and loop. Loss is not a proxy for mathematical execution here.","next_question":"Can an execution-aware training objective teach the small model to emit one independently checkable intermediate claim, rather than optimizing full prose likelihood?"}
{"iteration":45,"timestamp":"2026-07-19T09:48:31Z","hypothesis":"Ordinary-English concept labels can activate mathematical procedures stored in the numerical checkpoint.","change_summary":"Prompted iteration 14 on five polynomial and five Diophantine near statements in its learned trace format with English concept labels.","result":{"polynomial_full_strict":0,"diophantine_full_strict":0,"polynomial_predictions_sha256":"c87f745233df1f247eb7e7241117fd57ec8da81207b05e04a7771f726696f75d","diophantine_predictions_sha256":"25e215fdcf7e707c140250c18644e154d6a236cce838ab1458176d73a0e41846"},"decision":"use the method-relevant but mixed-validity outputs to define an atomic-claim benchmark","failure_mode":"Labels activated relevant methods, but unrestricted responses mixed correct and false claims, so faithful certification rejected all full arguments.","next_question":"Can atomic post-training teach exactly one sufficient verifiable claim pair?"}
{"iteration":46,"timestamp":"2026-07-19T09:48:31Z","hypothesis":"Sixty completion-only updates on atomic claims will teach certifiable deductions rather than proof-like prose.","change_summary":"Built sealed polynomial-difference and Diophantine-gcd atomic data, fixed training tokenization to match the inference boundary, and trained all 596M parameters for 60 AdamW updates.","result":{"validation_loss_start":2.489,"validation_loss_end":0.151,"trained_tokens":1147,"peak_metal_gb":5.48,"near":{"count":32,"strict":5,"semantic":6,"semantic_rate":0.1875,"report_sha256":"e0a4144a06469caf1741670714a0da34dbfe749322af05201592330faccc1b60"},"paraphrase":{"count":32,"semantic":0,"report_sha256":"230d7fecba1115d5bc088ba7da5a1906f26f1f88227476f3a0a21db6d866067a"},"concept_ablation":{"correct":6,"none":3,"wrong":3,"helped":4,"harmed":1,"p":0.375},"composition_semantic":2,"weights_sha256":"1b2d4ec3400073d738354ff009647ccde86a286f007321916b65c7b5c93d9a60"},"decision":"continue only with language diversity","failure_mode":"Real near successes appeared, but paraphrase transfer was zero and label causality remained underpowered.","next_question":"Is the gain causal relative to the parent, and can paraphrase development transfer to a sealed holdout?"}
{"iteration":47,"timestamp":"2026-07-19T09:48:31Z","hypothesis":"Atomic training, not the parent numerical model, caused the six near successes.","change_summary":"Evaluated untouched iteration 14 once on the identical sealed atomic near and paraphrase sets.","result":{"parent_near_semantic":0,"parent_paraphrase_semantic":0,"iteration46_near_semantic":6,"helped":6,"harmed":0,"difference_pp":18.75,"exact_paired_sign_p":0.03125,"near_report_sha256":"6b86ecb1e5d67d235dc51e0925b280e95f62eb193d1b08db2e8673a5886b0a22","paraphrase_report_sha256":"c7e563a905301e6b34e094dc3803d47283162c71eee6960edbd86ddde287043f"},"decision":"accept the first statistically nontrivial learned-deduction signal","failure_mode":"Only six near cases succeeded and none paraphrased.","next_question":"Can declared paraphrase development improve a separately sealed holdout without sacrificing near performance?"}
{"iteration":48,"timestamp":"2026-07-19T09:48:31Z","hypothesis":"Canonical-plus-paraphrase-development training will transfer to held-out numbers under the same four paraphrase templates.","change_summary":"Sealed first-eight development versus last-eight holdout per family, then continued iteration 46 for 100 updates on 120 canonical examples plus five repetitions of 16 development examples.","result":{"holdout_verifier_sha256":"360b8a6d4e0f71e33b0d03be4024cd848b3e2336676f184bd83f3e7bd4e7abc5","validation_loss_start":0.147,"validation_loss_end":0.13,"trained_tokens":1904,"peak_metal_gb":5.498,"holdout":{"count":16,"semantic":3,"all_family":"diophantine_solvability","report_sha256":"818402f085113d18dd5781d455d83be7c49b542ff3847835e849614a1c0fb0f5"},"near":{"count":32,"semantic":6,"report_sha256":"9881273cb1321fd4310296c92351a2f9d73af21922b0dd328c58ae3413b13fa5"},"weights_sha256":"c74d1827653441097812a078813a6f6536613d3662b98b465579aab41849b697"},"decision":"promote only the Diophantine atomic family as a viable specialist direction","failure_mode":"This is number transfer under seen template families, not unseen-language abstraction; polynomial holdout remains zero.","next_question":"Can a one-concept specialist improve exact gcd-divisibility claims and support full Lean conclusions?"}
{"iteration":49,"timestamp":"2026-07-19T09:48:31Z","hypothesis":"Focused Diophantine atomic training can supply exact sufficient claims from which a fixed theorem derives the original conclusion in Lean without repair.","change_summary":"Continued iteration 48 for 100 updates on 60 canonical Diophantine examples plus ten repetitions of eight development examples; accepted only full-response semantic matches; compiled claim certificates and four original conclusions via one fixed linear-combination iff gcd-divides theorem.","result":{"holdout_verifier_sha256":"7be6673b1a516b6022e222f90ad7da5d0788f818a5cc88759ebdb834b5160e1c","validation_loss_start":0.094,"validation_loss_end":0.076,"trained_tokens":1875,"peak_metal_gb":5.498,"holdout":{"count":8,"strict":4,"semantic":4,"rate":0.5,"parent":3,"helped":2,"harmed":1,"report_sha256":"8900b31a2a61e82d5952825bf327d34cfec9cf82ba6a8657f6074f8e2fbd6d12"},"near":{"count":16,"semantic":3,"rate":0.1875,"report_sha256":"8269abb9f9a53cb31d5e17194a3de7b81a33b4f8b42b48b2ee6e6fd1397f7d69"},"weights_sha256":"116d19ad558758ecaa9fc1abc9ba12534691396859db6e23ae0bd1d0c484cced","lean":{"accepted_claims":4,"claim_certificates":8,"derived_conclusions":4,"compile":"pass","certificate_sha256":"c98a3bc14811ce0aedad32c00577f21513c7ce8222ef16edc0d106f0c9d60de9","manifest_sha256":"1a8dde51437c616fc33834d90f5301968badea1519d42a3397d1b77223eb22bf"}},"decision":"retain as the first model-contributed end-to-end Lean-certified specialist","failure_mode":"Only four of eight tiny same-template-family holdout cases and three of sixteen harder-number cases pass; specialization's one-case gain over iteration 48 is not decisive.","next_question":"Can verifier-guided rejection sampling or confidence calibration improve accepted precision and coverage without changing weights, and did specialization damage routing?"}
{"iteration":50,"timestamp":"2026-07-19T10:19:22Z","hypothesis":"The Diophantine specialist retains enough general representation for a tiny frozen router to select its method without storing theorem names in the model.","change_summary":"Applied the previously sealed 31 KB base-model routing head to the iteration-49 specialist on the untouched 100-item contrast-v3 set.","result":{"accuracy":0.93,"pair_accuracy":0.86,"diophantine_accuracy":1.0,"polynomial_to_diophantine_errors":7,"count":100,"peak_metal_gb":1.236,"probe_bytes":30984,"predictions_sha256":"daccaa711e57e106140e138b28643bf3e15143e5e4354996499302e89d9f4a88","report_sha256":"7c77f9245cc991bbc8f64fdeabc4ce46e7fb1446993cbabe3cbf12e69d03c0f9"},"decision":"retain the specialist-plus-frozen-router architecture as viable","failure_mode":"Routing remained strong overall but specialization pulled seven polynomial problems toward the Diophantine label.","next_question":"Can external verification improve answer coverage through sampling without trusting model confidence?"}
