{"iteration":91,"timestamp":"2026-07-19T20:50:10Z","hypothesis":"The first-step specialist can be represented as an int8 delta from iteration 67, reducing extra storage while preserving prefix behavior.","change_summary":"Quantized the iteration-67 to iteration-89 parameter delta symmetrically per tensor, reconstructed the specialist during inference, and compared extracted prefixes on v18. The user stopped the campaign before any new continuation pass was launched.","result":{"delta_bytes":596125674,"delta_sha256":"6e85ce2c0b124e20bcf411a092a4a5f947ad6ff0a9d1397cb4593dacbfb50a0b","relative_l2_error":0.015950397439826892,"count":300,"exact_prefix_match_vs_full":280,"full_first_step_exact":163,"quantized_first_step_exact":165,"helped":4,"harmed":2,"p":0.6875,"generation_prompts_per_second":0.83184,"peak_reconstruction_gb":1.955972984,"comparison_report_sha256":"d7993a1335e48db95ff3ac39972702ac9fed78c643ab8b7724075f18f3de172e"},"decision":"freeze as promising but do not promote without an end-to-end continuation and strict-verifier comparison","failure_mode":"Runtime reconstruction raises peak memory above the full checkpoint, and early stop leaves the staged output unverified end to end.","next_question":"If work resumes, test the frozen delta prefixes through the unchanged iteration-67 continuation on a new or preregistered suite before considering deployment."}
{"iteration":92,"timestamp":"2026-07-19T20:51:00Z","hypothesis":"Every strict trace accepted from the promoted staged v18 procedure can be independently certified in Lean without using the model's prose as trusted arithmetic.","change_summary":"Generated Lean theorems only for the 92 staged responses accepted by the fixed trace checker, restating all 362 model-generated Euclidean equalities, and compiled the generated file under the pinned Lean project during early-stop closeout.","result":{"accepted_claims":92,"trace_step_certificates":362,"lean_compile":"pass","certificate_sha256":"e4f1b31a6fa7a33a74f688cfc48448d12298b7a47d2949cde6e35901e27e6bab","manifest_sha256":"815b1727473e73a37bb4aef28f8729ef1389c2a022d6f498420f3ad2730f7b76","verifier_sha256":"3741fcb14096d9b1b58dab030e58db60e14e733a681c16d92759ff1809f7dd89"},"decision":"complete the promotion gate for the staged core procedure","failure_mode":"Lean certifies only checker-accepted arithmetic cores; it does not turn rejected prose into mathematics or establish broad mathematical ability.","next_question":"Campaign stopped at the user's request; resume only from the frozen int8-delta end-to-end validation question."}
