{"iteration":64,"timestamp":"2026-07-19T11:58:00Z","hypothesis":"A frozen, parameter-disjoint operand ladder will locate the trace checkpoint's arithmetic reliability cliff between coefficients 216 and 2,500.","change_summary":"Sealed three 80-case unseen-template bands with maximum coefficients constrained to 217–500, 501–1,000, and 1,001–2,500; verified every oracle; generated all 240 frozen-checkpoint predictions before opening any verifier; strictly scored complete and core-valid traces; compiled every core-valid argument in Lean.","result":{"bands":{"217_500":{"count":80,"parsed":77,"trace_valid":16,"trace_rate":0.2,"complete":8,"complete_rate":0.1,"predictions_sha256":"bf2ac9fcbe5463950fb813ac0ad2867eef61fb13eb181f807a189ef07a59644b","verifier_sha256":"8ad15ea874f4f13667f6ac6a5954eb01fbf04673a703dd1c1f95b18cae39f594","report_sha256":"86e4da8a63394c0a6faec194d292171714918dd166ffa83ed5b1d39d9f495934","lean_trace_steps":79,"lean_compile":"pass","certificate_sha256":"dfbc5a293fa17f52e0b9e4e69b8bbbc2cd3ea046935e749c31a9bbc80e2ae220"},"501_1000":{"count":80,"parsed":77,"trace_valid":10,"trace_rate":0.125,"complete":7,"complete_rate":0.0875,"predictions_sha256":"b3968b8145d6760d23a66a8f343515ba971d692e8f31663546f741f1b645d321","verifier_sha256":"75a1731aa6e298c364434c0dd64b9071b175059d45fbacfc8286325141e65cb2","report_sha256":"20674cc24a25ee5f5577b171412ad1abf88b007d203285f603fb907584c2244c","lean_trace_steps":49,"lean_compile":"pass","certificate_sha256":"defc01efe1349471585b90a67e6ea2bbae7caf4b5da078e1e67f806ccfe3509f"},"1001_2500":{"count":80,"parsed":78,"trace_valid":1,"trace_rate":0.0125,"complete":1,"complete_rate":0.0125,"predictions_sha256":"181bb94e97b09cf80668b2f85c2a8f8579d3fa438eb91a45f9ff61b3bbccdbd1","verifier_sha256":"edd24cd4b79523dac882b08600bc023fbab4646ae2e82ebfbb03d662504d6e2c","report_sha256":"c7f641650a8551018dc3c9c178ae3b5c9485e874f45a4e2a4aa46e465d710c30","lean_trace_steps":3,"lean_compile":"pass","certificate_sha256":"3121bd3d482eacce0b1577d9a89a8516a40a6d7f294e4182976d4b69a4ce892e"}},"comparison":{"small_le_216_complete_rate":0.32,"small_le_216_core_rate":0.515,"interpretation":"The main arithmetic cliff begins above coefficient 500 and becomes severe above 1,000; parse rate remains above 95 percent in every band."}},"decision":"use coefficient 500 as the next progressive-curriculum boundary; do not train on any opened ladder test","failure_mode":"Band samples are 80 each and share the same held-out language templates, so they locate numeric scale but do not test broader semantic diversity.","next_question":"Can a fresh development-only curriculum extend the reliable core beyond coefficient 500 without damaging the 32 percent small complete rate?"}
{"iteration":65,"timestamp":"2026-07-19T12:50:00Z","hypothesis":"Training only on fresh coefficient-217–1,000 development data can extend medium-range trace reliability without damaging the established short-trace regime.","change_summary":"Built a new parameter-disjoint 800/160 medium curriculum and a sealed 200-case promotion test split evenly between fresh small and medium instances; verified all oracles; sealed iteration-61 baseline predictions; trained all 596M parameters for 300 updates; sealed candidate predictions before opening the test; ran paired complete-argument and core-valid comparisons; compiled both accepted tiers in Lean.","result":{"benchmark":{"train":800,"valid":160,"test":{"small":100,"medium":100},"test_prompt_sha256":"2b8d1a83e959dc1da39224dcec023186c60b876a720fbe9b51ff4e80fab8ce4e","test_verifier_sha256":"87076410e72a97f5f489959e60e6a66b9a2c3883e9091d1ecc9a6dc022f99cb4","oracle_pass":200},"training":{"validation_loss_start":0.057,"validation_loss_step150":0.058,"validation_loss_end":0.056,"trained_tokens":31260,"peak_metal_gb":5.555,"weights_sha256":"eb03005648128db8e4b8e6acf6c93c61ebdb3ff29cb2aaa899944965d4a15c03"},"complete":{"baseline":37,"candidate":60,"count":200,"baseline_rate":0.185,"candidate_rate":0.3,"helped":26,"harmed":3,"mcnemar_exact_two_sided_p":1.523643732070923e-05,"small":{"baseline":27,"candidate":46,"helped":20,"harmed":1,"p":2.09808349609375e-05},"medium":{"baseline":10,"candidate":14,"helped":6,"harmed":2,"p":0.2890625},"baseline_predictions_sha256":"8e17d52a2675e1a906f5d3073ee0a6039d7ce161cbe7c175ba65d36e0dc12687","candidate_predictions_sha256":"490dacdfe66e57bdce5d02e0cb06191b8b8be0efa21514ec3c4f3d3fec78177e","paired_report_sha256":"cf3ed0480616f1d62cfd2bf5f58d74d44ec7a9f13b4684494220290f4b547163"},"core":{"baseline":69,"candidate":88,"count":200,"baseline_rate":0.345,"candidate_rate":0.44,"helped":24,"harmed":5,"p":0.0005461126565933228,"small":{"baseline":52,"candidate":67,"p":0.000728607177734375},"medium":{"baseline":17,"candidate":21,"p":0.34375},"paired_report_sha256":"7e7025a3748dc22fcaadf004c1292a56c77db80c5c0b7aa904943fd7e959f47c"},"lean":{"complete_arguments":60,"complete_trace_steps":193,"complete_compile":"pass","complete_certificate_sha256":"67fabcff8289c5dcd07659c22c480b9a5cd945da78635b984b0845dd989c0439","core_arguments":88,"core_trace_steps":278,"core_compile":"pass","core_certificate_sha256":"49ee612830b36f54a3d267f02be3362d68bb9cbc7e129ac00875b37780aea117"}},"decision":"promote iteration 65 because it substantially improves fresh complete and core-valid reasoning without small-band forgetting","failure_mode":"The medium split improves only four points and is not significant; almost all decisive gain is on shorter traces, so the numeric-range extension hypothesis remains unproven.","next_question":"Does the promoted checkpoint retain general method routing, and should the next curriculum target trace length rather than raw coefficient size?"}
{"iteration":66,"timestamp":"2026-07-19T12:50:00Z","hypothesis":"The promoted curriculum checkpoint preserves the general method concepts visible to the unchanged tiny router.","change_summary":"Applied the same sealed 31 KB frozen routing head to iteration 65 on the untouched 100-item five-family contrast test, with no fitting or selection.","result":{"accuracy":0.94,"pair_accuracy":0.88,"diophantine_accuracy":1.0,"count":100,"probe_parameters":5120,"probe_bytes":30984,"peak_metal_gb":1.236,"predictions_sha256":"5d9f249588a95ef6540e8d805e8c0cb3195f0e9b39a0bcb314943055a71733d1","report_sha256":"2635365fda14319baaf46dce3da3be4519cfc512c8d126870959313d0e2c5ff2"},"decision":"retain iteration 65 as the promoted checkpoint; the one-point routing and two-point pair decrease from iteration 61 is acceptable","failure_mode":"Six polynomial items are misrouted, and this remains a synthetic closed-set routing test rather than broad theorem understanding.","next_question":"Can trace-length-stratified development data improve medium execution while preserving the promoted short-trace gains?"}
{"iteration":67,"timestamp":"2026-07-19T11:53:35Z","hypothesis":"A curriculum selected by oracle Euclidean-chain length rather than coefficient magnitude will improve four-or-more-step computation without erasing the established short-chain regime.","change_summary":"Measured iteration-65 performance by oracle trace length; built a fresh parameter-disjoint 800/160 long-chain curriculum and a sealed 200-case test split evenly into at-most-three-step and at-least-four-step traces; passed all 200 oracle checks; froze baseline predictions before training; updated all 596.05M parameters for 300 steps; sealed candidate predictions before opening the verifier; ran paired exact and core-valid tests; compiled every accepted numerical claim and conclusion in Lean.","result":{"diagnostic":{"one_to_three_steps":{"count":113,"complete_baseline":23,"complete_candidate":43,"complete_p":1.0967254638671875e-05,"core_baseline":48,"core_candidate":64,"core_p":0.0008549690246582031},"four_to_five_steps":{"count":65,"complete_baseline":10,"complete_candidate":13,"complete_p":0.375,"core_baseline":15,"core_candidate":19,"core_p":0.21875},"six_plus_steps":{"count":22,"complete_baseline":4,"complete_candidate":4,"core_baseline":6,"core_candidate":5}},"benchmark":{"train":800,"valid":160,"test":{"short":100,"long":100},"excluded_parameters":5800,"oracle_pass":200,"test_prompt_sha256":"1041337c964c47cb773186938bdb6bb058012c0e30462b8c6c4bdfe52ef66840","test_verifier_sha256":"72b404dbe38b84306cb76b6b86ae40913e27cd16b384dded062444a48bb87177"},"training":{"validation_loss_start":0.048,"validation_loss_step150":0.041,"validation_loss_end":0.043,"trained_tokens":34705,"peak_metal_gb":5.555,"weights_sha256":"1c9fb3ed91625721ae610c6d13e981de25b4070faf04c8b3f0ec152673b30a2b"},"complete":{"baseline":28,"candidate":35,"count":200,"helped":11,"harmed":4,"p":0.11846923828125,"short":{"baseline":12,"candidate":14,"helped":5,"harmed":3,"p":0.7265625},"long":{"baseline":16,"candidate":21,"helped":6,"harmed":1,"p":0.125},"paired_report_sha256":"b24ce19e260018bfa4ad6914109b973466808a497013b4148975eae714c3e4b8"},"core":{"baseline":37,"candidate":45,"count":200,"helped":15,"harmed":7,"p":0.13380050659179688,"short":{"baseline":20,"candidate":19,"helped":5,"harmed":6,"p":1.0},"long":{"baseline":17,"candidate":26,"helped":10,"harmed":1,"p":0.01171875},"paired_report_sha256":"3a9b62af5f02307cca83f64b775486c155c3dbb3c9296b9ed0c3a69a8136d2c"},"lean":{"complete_arguments":35,"complete_trace_steps":143,"complete_compile":"pass","complete_certificate_sha256":"964e974ee20a973b92963a3eae95bdb285f2d52729ec12f12336e99fa47f8a6f","core_arguments":45,"core_trace_steps":177,"core_compile":"pass","core_certificate_sha256":"5976ac51136d4b5c7d9d5f4f54b646f61a2422cb38d27541b20d9c2688a1f9ee"}},"decision":"retain iteration 67 as the validated long-chain computation specialist: its preregistered long-core target improves significantly without significant short-chain harm; do not claim a significant overall or complete-argument gain","failure_mode":"Overall complete and core gains are not significant, the short core changes by minus one, and validation loss worsens after step 150; this is a targeted extension rather than broad mathematical progress.","next_question":"Does the unchanged tiny method router survive the long-chain specialization, and can a future run retain the step-150 checkpoint for a cleaner promotion comparison?"}
{"iteration":68,"timestamp":"2026-07-19T11:53:35Z","hypothesis":"The long-chain specialist preserves the natural-language method representation exposed by the unchanged sealed 5,120-parameter router.","change_summary":"Applied the same frozen layer-21 mean-pooled ridge readout to iteration 67 on the untouched 100-item five-family contrast test, with no fitting, selection, or theorem-name input.","result":{"accuracy":0.96,"pair_accuracy":0.92,"diophantine_accuracy":1.0,"count":100,"probe_parameters":5120,"probe_bytes":30984,"peak_metal_gb":1.2354,"predictions_sha256":"db1adaaa76bfa19bd34ea634613a27f7acc8a280c93a05e98da7fec4b74abcb7","report_sha256":"9b888da3f701d8e4bd498590360e18f11850a07d10557e2971fd1717640aedfb"},"decision":"retain iteration 67; routing remains intact and slightly exceeds the iteration-65 audit","failure_mode":"The router still covers only five synthetic families; four polynomial statements are misrouted, and routing does not demonstrate execution outside the Diophantine procedure.","next_question":"Can a second genuinely different procedure be added while replaying both the verified Euclidean suites and the frozen routing contrast?"}
{"iteration":69,"timestamp":"2026-07-19T12:25:26Z","hypothesis":"Eight-bit affine quantization will substantially reduce deployment memory and latency while preserving the iteration-67 verified-core capability.","change_summary":"Added a reproducible full-checkpoint quantizer; assembled iteration 67 with its base architecture; quantized every eligible layer to 8-bit affine groups of 64; generated 200 frozen predictions before scoring on the existing trace-length suite; compared paired complete and core-valid behavior with the full checkpoint.","result":{"weight_bytes":633443038,"weight_reduction":0.46865,"effective_bits_per_weight":8.501,"weight_sha256":"1f8ea0aae28fbefeb73a9cec6a7a4a597d580102d9f9faba1a18cdfa2ac27d1f","inference_peak_gb":0.807371396,"full_inference_peak_gb":1.355137688,"prompts_per_second":0.8769940537359125,"full_prompts_per_second":0.6007951494662293,"diagnostic_complete":{"full":35,"quantized":33,"helped":2,"harmed":4,"p":0.6875},"diagnostic_core":{"full":45,"quantized":44,"helped":3,"harmed":4,"p":1.0},"report_sha256":"0a3522e3408deaf6d992da5a12032487c2195330eedadc05c5886acf1ce76d1b"},"decision":"advance 8-bit to a fresh paired confirmation; do not yet call it lossless","failure_mode":"The first test was already opened during iteration-67 selection and exact complete arguments decreased by two, so it is diagnostic rather than an independent promotion test.","next_question":"Does the small apparent degradation replicate on a newly sealed parameter-disjoint test?"}
{"iteration":70,"timestamp":"2026-07-19T12:25:26Z","hypothesis":"Four-bit affine quantization will preserve enough of the post-trained mathematical procedure for a sub-0.6-GB runtime.","change_summary":"Quantized the same assembled iteration-67 checkpoint to 4-bit affine groups of 64 and generated all 200 predictions before opening the existing trace-length verifier.","result":{"weight_bytes":335450548,"weight_reduction":0.71861,"effective_bits_per_weight":4.501,"weight_sha256":"912787c952c8e17511afb337289baa091ac8f3b603ac980cbc922177adf6446f","inference_peak_gb":0.508314342,"prompts_per_second":0.6209948375187723,"parsed":0,"complete":0,"core":0,"full_complete":35,"full_core":45,"complete_p":5.820766091346741e-11,"core_p":5.684341886080802e-14,"report_sha256":"74b018ca3177c5ed720578413a2b32c0862a554b4c07f5318b0da606098bf3fc"},"decision":"reject naive 4-bit quantization","failure_mode":"The model reverts to fluent generic explanations and loses the learned exact-output procedure; lower storage does not improve throughput over full precision on this hardware.","next_question":"Is the viability boundary at six bits, or does only eight-bit preserve the small full-post-training weight changes?"}
{"iteration":71,"timestamp":"2026-07-19T12:25:26Z","hypothesis":"Six-bit affine quantization is enough to preserve the learned procedure while approaching four-bit memory use.","change_summary":"Quantized iteration 67 to 6-bit affine groups of 64; generated and scored the full 200-case existing trace-length suite under the same greedy contract.","result":{"weight_bytes":484446856,"weight_reduction":0.59363,"effective_bits_per_weight":6.501,"weight_sha256":"4fb679f4744757c93adfd03967510a2c8beb8e94b2f6567539468f1c13bca644","inference_peak_gb":0.657949672,"prompts_per_second":0.8108534883282336,"parsed":142,"complete":6,"core":21,"full_complete":35,"full_core":45,"complete_p":4.873598300036974e-06,"core_p":6.960169412195683e-05,"report_sha256":"8cb67d7b07841c2a14b269e2239e13899b67e21962815b5d6a20c1d3bb937d92"},"decision":"reject naive 6-bit quantization; the practical viability boundary is above six bits","failure_mode":"Some exact-format behavior survives, but complete and core capability both degrade decisively.","next_question":"Can eight-bit preserve the core result on an independently sealed test?"}
{"iteration":72,"timestamp":"2026-07-19T12:25:26Z","hypothesis":"On a fresh parameter-disjoint short/long suite, eight-bit iteration 67 will retain verified-core capability with materially lower peak memory and faster inference.","change_summary":"Sealed 100 fresh at-most-three-step and 100 fresh at-least-four-step cases after excluding 7,078 prior parameter triples; passed all 200 oracles; generated full and 8-bit predictions before opening the verifier; ran paired complete and core comparisons; compiled every accepted 8-bit equality and conclusion in Lean.","result":{"benchmark":{"count":200,"short":100,"long":100,"oracle_pass":200,"prompt_sha256":"d0192b44487b4574f22d233a08a7c30fec090585cf209ca39d542d8532fa0c31","verifier_sha256":"bdbcd605ee9f8065a1b2dec37ee549182def4f61b76a8f484b488c3b9fbc86bc"},"efficiency":{"full_seconds":341.357,"eight_bit_seconds":229.402,"full_prompts_per_second":0.585897,"eight_bit_prompts_per_second":0.871832,"full_peak_gb":1.355138,"eight_bit_peak_gb":0.807371},"complete":{"full":41,"eight_bit":35,"helped":0,"harmed":6,"p":0.03125,"paired_report_sha256":"8b0a1601ffa2dbd4111bcd377c2a67f8e0453b179fbd3250133ed7489c6d57ca"},"core":{"full":59,"eight_bit":54,"helped":2,"harmed":7,"p":0.1796875,"paired_report_sha256":"05c6c2ec0c2d35a7d3e1bf731a15bbe5e267a05e2996fcd4c0cc20c6dec6e519"},"lean":{"complete_arguments":35,"complete_trace_steps":151,"complete_compile":"pass","complete_sha256":"98a00d3b283f79917ba8fbd39cd48827665cdab78f23d05575a76e102d2d5c5c","core_arguments":54,"core_trace_steps":227,"core_compile":"pass","core_sha256":"38988a88212b525f62f96da4d8383e503f9f37c2745d5cc162133521f0087261"}},"decision":"promote eight-bit as the deployment checkpoint for the fixed-verifier core architecture, but retain full precision as the accuracy checkpoint; eight-bit is not lossless for model-complete arguments","failure_mode":"Exact complete arguments lose three percentage points significantly; the 2.5-point core decrease is not significant at n=200 but cannot establish equivalence without a non-inferiority margin and larger sample.","next_question":"Can low-rank recovery on the rejected four-bit backbone restore the procedure while keeping total deployment below the eight-bit footprint?"}
{"iteration":73,"timestamp":"2026-07-19T12:25:26Z","hypothesis":"Eight-bit quantization preserves the frozen natural-language method representation.","change_summary":"Applied the unchanged sealed 5,120-parameter readout directly to the standalone 8-bit model on the untouched 100-item five-family contrast test.","result":{"accuracy":0.96,"pair_accuracy":0.92,"diophantine_accuracy":1.0,"count":100,"probe_bytes":30984,"peak_metal_gb":0.84014,"prompts_per_second":13.6357,"predictions_sha256":"fc98f9a7953017bb50d2eacdc440b56d49694598e4456551a1ef2baafbab61b4","report_sha256":"ed5841090161b1704438938d2c90b123e31d7630fd14409ab5cb8f19c25e5e30"},"decision":"retain the 8-bit deployment artifact; routing is identical to full precision","failure_mode":"The router is a synthetic closed five-way test and does not offset the measured complete-argument loss.","next_question":"Can a compact adapter recover four-bit mathematical execution without bloating memory or weakening the fixed-verifier boundary?"}
{"iteration":74,"timestamp":"2026-07-19T12:38:25Z","hypothesis":"A roughly 40 MB low-rank adapter can recover verified mathematical execution on the rejected 4-bit backbone while keeping deployment below the 8-bit footprint.","change_summary":"Merged 1,600 previously declared medium and long development examples; froze the 4-bit backbone; trained rank-16 adapters across all transformer blocks for 300 updates using raw completion masking; retained step 150 and 300; selected step 300 by held-out loss; generated and scored all 200 existing trace-length cases.","result":{"trainable_parameters":10093000,"trainable_fraction":0.01693,"adapter_bytes":40412738,"adapter_sha256":"a4ef3dc6a449019b3a3b3f57c9b72237764a6201255da5ea8af5dc9c5eae96e1","validation_loss_start":0.602,"validation_loss_step150":0.186,"validation_loss_step300":0.142,"training_peak_gb":1.032,"inference_peak_gb":0.598,"prompts_per_second":0.6659,"parsed":200,"final_valid":15,"complete":0,"core":1,"full_complete":35,"full_core":45,"report_sha256":"be44924df72b85effb51e1d4595d8e85a88e5e43a2b84434d3fe8227a5bda0ed","core_comparison_sha256":"6367179e0faec9477cfe9cc537ef988ddf776ff368c41a108d1e770da647387b"},"decision":"reject the 4-bit low-rank recovery; retain 8-bit as the minimum viable deployment","failure_mode":"The adapter restores exact surface format to 100 percent and sharply lowers validation loss but restores only one valid arithmetic chain and no complete argument, demonstrating format recovery without mathematical recovery.","next_question":"Can verifier-guided multi-sample decoding raise usable 8-bit core coverage without changing the model or accepting any invalid arithmetic?"}
{"iteration":75,"timestamp":"2026-07-19T13:03:36Z","hypothesis":"Verifier-guided multi-sample decoding can raise usable 8-bit core coverage without changing weights or admitting invalid arithmetic.","change_summary":"On the existing 200-case trace-length development suite, generated greedy decoding followed by three temperature-0.3 samples with fixed seeds 23, 47, and 71; selected the first candidate whose complete Euclidean chain passed the fixed trace verifier.","result":{"count":200,"candidates":4,"coverage_by_prefix":[44,50,52,58],"greedy_core":44,"selected_core":58,"helped":14,"harmed":0,"mcnemar_exact_two_sided_p":0.0001220703125,"short_coverage_by_prefix":[19,23,25,29],"long_coverage_by_prefix":[25,27,27,29],"selection_metric":"trace_valid only","selection_report_sha256":"7b4a4d9df74acb7b11fe4c3091c5efde2703d68c73c939544a790d73377033dc","selected_predictions_sha256":"efab1f8fb4e89b54438932bca4c18e93ad02d0900b3ac0ca60ca2c52e484d8b8"},"decision":"provisionally retain verified multi-sample decoding and require a fresh sealed confirmation before promotion","failure_mode":"Four candidates multiply serial generation cost; this development result may overestimate the gain because the sampling policy was chosen on the same suite.","next_question":"Does the pre-registered four-arm policy reproduce on a fresh parameter-disjoint sealed short/long suite?"}
