{"iteration":76,"timestamp":"2026-07-19T13:03:36Z","hypothesis":"The pre-registered verifier-guided four-arm policy will reproduce a core-coverage gain on a fresh parameter-disjoint sealed suite.","change_summary":"Sealed 100 fresh cases after excluding 7,278 prior parameter triples; generated all four registered arms before opening the verifier; selected only by full trace validity; paired greedy against selected output; generated and compiled Lean certificates for every accepted selected trace.","result":{"benchmark":{"count":100,"short":50,"long":50,"oracle_pass":100,"prompt_sha256":"57851373e50f2f5deb8270437e3395f2ad2800b06424c84dbd942b619d4d91e6","verifier_sha256":"3ce1b72743d3a5b88a186932c3441ac7c9587cc8a49991ef236d1bc16c0b80a7"},"generation":{"arms":4,"seconds_per_arm":[118.77,118.55,118.73,118.73],"peak_metal_gb":0.807371422,"coverage_by_prefix":[22,24,26,27]},"core":{"greedy":22,"selected":27,"delta":0.05,"helped":5,"harmed":0,"mcnemar_exact_two_sided_p":0.0625,"short_greedy":8,"short_selected":12,"long_greedy":14,"long_selected":15,"paired_report_sha256":"3ae82b86b26089c0211a5d5a407b5148fe1ad9b48eab5770bdbc3f747cacb129"},"lean":{"accepted_arguments":27,"trace_step_certificates":112,"compile":"pass","certificate_sha256":"df441ee92541ee2ec9a564e7a0b01b325cb7832a704471b037c6ef7a03edb989"},"selection_report_sha256":"095445e050c08407ae985b06b8e9668f096086b8147d7352c542b84ca07f5342","selected_report_sha256":"05b122202b9309d8168a1dd9a068596ba75cf0d0119c4bd1780d5cceaa3f4a10"},"decision":"retain as promising optional inference-time search, but do not claim independent confirmation at n=100 because p=0.0625; the direction reproduced with zero regressions and all selected cores compiled in Lean","failure_mode":"The fresh gain is only five cases and is concentrated in short traces; exhaustive serial decoding costs about four times greedy latency.","next_question":"Can verifier-triggered early stopping and a measured cost-quality curve make the search practical without weakening validity?"}
{"iteration":77,"timestamp":"2026-07-19T16:20:00Z","hypothesis":"When coefficient magnitude and Euclidean-chain length are crossed independently, chain length will remain the stronger predictor of verified failure.","change_summary":"Built a fresh 480-case parameter-disjoint factorial diagnostic with 80 examples in each small/medium/large by short/long cell; passed all 480 oracle checks; froze 8-bit greedy predictions before scoring; fit fixed five-fold diagnostic models for magnitude, chain length, and local quotient difficulty.","result":{"benchmark":{"count":480,"cells":6,"per_cell":80,"excluded_parameters":7478,"oracle_pass":480,"manifest_sha256":"8d1b6c95889dc8a74c2f53736f4eaada2a50cd620bfa7499b3467fa67ca6dbf5"},"efficiency":{"seconds":537.588,"prompts_per_second":0.892877,"peak_metal_gb":0.812287},"core":{"overall":123,"rate":0.25625,"small_short":40,"small_long":49,"medium_short":8,"medium_long":14,"large_short":3,"large_long":9},"cross_validated_auc":{"chain_only":0.502835,"magnitude_and_digits":0.77919,"local_quotient":0.65725,"all":0.800278},"cross_validated_log_loss":{"constant":0.570604,"chain_only":0.570401,"magnitude_and_digits":0.457718,"local_quotient":0.539023,"all":0.446053},"predictions_sha256":"ca0e7e5ca43457ec4597844138a1fc60714a7a821429686af36fdb984de3c592","strict_report_sha256":"c2afb2781af14d9cad145e82d89030765a4de7467dcf547e35a1ddea5b965f96","difficulty_report_sha256":"53876e9aaec0d3be924e05d94a4582b4e52dfa79aba79f58d588336622991071"},"decision":"reject the chain-length-dominant explanation; prioritize numerical representation while retaining local quotient difficulty as a secondary factor","failure_mode":"The prior chain-length correlation was confounded: within every magnitude band, long examples outperformed short examples; short chains often contain harder large-quotient divisions.","next_question":"Can an explicit place-value representation improve frozen or post-trained verified arithmetic at medium and large magnitudes without harming the natural-language interface?"}
{"iteration":78,"timestamp":"2026-07-19T16:40:00Z","hypothesis":"A natural-language rendering that makes decimal place explicit will improve frozen verified arithmetic more than raw digits or number words, especially at medium and large magnitudes.","change_summary":"Selected 20 already-opened diagnostic cases per factorial cell; compared the frozen 8-bit checkpoint under unchanged decimal prompts, decimal-plus-place-value annotations, and numbers rendered entirely as English words; kept output and strict verifier unchanged.","result":{"count":120,"baseline_core":26,"place_value_core":25,"place_value_helped":8,"place_value_harmed":9,"place_value_p":1.0,"number_words_core":9,"number_words_helped":3,"number_words_harmed":20,"number_words_p":0.00048828125,"place_value_peak_gb":0.827098,"number_words_peak_gb":0.814285,"place_value_report_sha256":"d528e5b08f142aeef599a9b589c37f1cfa00e1c129a3f54ad8c3e9d136fc5c0c","number_words_report_sha256":"956b4d595d212f1efd58edccd76e8f7019e85924f5094c8d1e39bf7798af3730","place_value_prompts_sha256":"2407d0e2999846c199b7fc51361ae0a260cefffa60b59805463317c28dc8947d","number_words_prompts_sha256":"7dac35f0acc96eb185dd196783ef700f8a5fe03ca18c2b4a48ec10c66371f636"},"decision":"reject number words; retain decimal-plus-place-value only as a training diagnostic because it preserves zero-shot behavior but does not improve it","failure_mode":"English number words sharply reduce parsing and eliminate all valid large cores; explicit place annotation causes nearly symmetric gains and losses without a net effect.","next_question":"Can a mixed place-value plus ordinary-decimal curriculum teach use of the annotation while preserving the original interface?"}
{"iteration":79,"timestamp":"2026-07-19T17:35:00Z","hypothesis":"A mixed full-parameter curriculum of explicit place-value prompts and ordinary decimal rehearsal can improve reusable verified arithmetic cores without losing the original natural-language interface.","change_summary":"Built 1,200 fresh place-annotated training examples balanced across six magnitude/length cells and mixed them with 1,600 prior ordinary-decimal rehearsal examples; trained all 596.05M parameters from iteration 67; stopped immediately after the saved step-150 gate when validation returned to its initial 0.064 after worsening; froze candidate and full-precision-control predictions on the 480-case opened factorial diagnostic.","result":{"training":{"steps":150,"train_examples":2800,"valid_examples":560,"validation_loss_start":0.064,"validation_loss_step75":0.068,"validation_loss_step150":0.064,"peak_metal_gb":5.555,"weights_sha256":"43ca45aac3943fcd8098e0834c92ce70207fc9bac4c418a7f79984ce57bb2372","training_manifest_sha256":"1996ecfffda93d238d9ffd64b293cbe0df0480a54681d78181ee4026c3b32c36"},"ordinary_interface":{"count":480,"full_control_core":131,"candidate_core":144,"helped":33,"harmed":20,"p":0.09837064844049181,"full_control_complete":92,"candidate_complete":95,"complete_p":0.7428293587290682,"core_report_sha256":"9ef689efe21aa668e374c6b6db7682bab9ebfa771b8217b44e855693e7c6f952","complete_report_sha256":"2b9b9e94130909d98d1f3cd1b66b314bfb3a61d71c7438bbafa0a152d9ab0f62"},"annotated_screen":{"count":120,"eight_bit_baseline_core":25,"candidate_full_core":28,"helped":7,"harmed":4,"p":0.548828125}},"decision":"freeze the step-150 candidate and advance only the ordinary interface to a fresh paired confirmation; do not promote from the opened diagnostic","failure_mode":"Validation loss did not improve, complete arguments are unchanged, and the diagnostic core gain narrowly misses significance; precision explains part of the apparent gain over 8-bit.","next_question":"Does the frozen candidate improve verified cores against full-precision iteration 67 on a fresh parameter-disjoint factorial confirmation?"}
{"iteration":80,"timestamp":"2026-07-19T17:58:00Z","hypothesis":"The frozen step-150 place-value curriculum candidate will improve verified arithmetic traces over the full-precision iteration-67 control on a fresh parameter-disjoint factorial benchmark.","change_summary":"Generated 300 fresh cases balanced across six magnitude-by-chain-length cells after excluding 9,398 prior parameter triples; completed exact greedy full-precision baseline and candidate generation before opening the verifier; then evaluated trace validity, semantic correctness, complete arguments, paired flips, and per-cell behavior.","result":{"count":300,"baseline_core":80,"candidate_core":80,"baseline_core_rate":0.26666666666666666,"candidate_core_rate":0.26666666666666666,"core_helped":12,"core_harmed":12,"core_p":1.0,"baseline_semantic":56,"candidate_semantic":55,"semantic_helped":8,"semantic_harmed":9,"semantic_p":1.0,"baseline_complete":112,"candidate_complete":111,"per_cell_candidate_minus_baseline_core":{"small_short":1,"small_long":1,"medium_short":1,"medium_long":-4,"large_short":1,"large_long":0},"prompt_sha256":"7ee8e7b4f0daf05ecdc169ea94d30feaae01b76df5f1c4a738aa3a0b03521302","verifier_sha256":"db193125c69b70c21b20164e10f625dc7c153bfc92ca96a7c7d60f7855ac1bb2","baseline_report_sha256":"ebd691a4511ceff70ceffbb359b2e30c331a66e680b36637e29bd3a7297a93e9","candidate_report_sha256":"55b4ddb97b761c76f445db15827f189c2c5dd9763e42be0af70471e09b9c96f5","paired_core_sha256":"9dad42ae61bf8c5d22d019365bc6ff775ef091ebe1b8e0e6e6f43c29035a5553"},"decision":"reject the place-value curriculum candidate; retain iteration 67 as the promoted full-precision model","failure_mode":"The opened diagnostic gain did not replicate: verified trace accuracy tied exactly, semantic and complete correctness were each lower by one, and medium-long traces regressed by four cores.","next_question":"Do frozen hidden states linearly encode numerical magnitude, decimal place, and exact value well enough to distinguish a representation bottleneck from a procedural arithmetic bottleneck?"}
{"iteration":81,"timestamp":"2026-07-19T20:50:00Z","hypothesis":"If the arithmetic cliff is caused by missing numerical representations, frozen hidden states should fail to linearly expose digits or magnitude, especially outside the trained range.","change_summary":"Probed frozen base and iteration-67 residual streams at five layers with ridge models for decimal digits and log magnitude, separating random interpolation over 1-2500 from extrapolation trained on 1-700 and tested above 1000.","result":{"iteration67_layer7_interpolation_exact_number_accuracy":1.0,"iteration67_layer7_interpolation_log_magnitude_r2":0.9919087161899537,"iteration67_layer7_extrapolation_log_magnitude_r2":-12.77578140027103,"report_sha256":"e41db0b6bc771f82782f074ec74c67ee97acb52cbfad6bd4b8b8c0c9832105dc"},"decision":"reject missing-digit-representation as the primary explanation; retain brittle magnitude extrapolation as evidence, not a causal claim","failure_mode":"A linear probe is only a lower bound on decodability and cannot establish that the model uses the decoded variable during division.","next_question":"Can direct training on isolated quotient-remainder steps improve execution, and does that transfer into full traces?"}
{"iteration":82,"timestamp":"2026-07-19T20:50:01Z","hypothesis":"Training the Euclidean quotient-remainder operation in isolation will improve the model's arithmetic step and transfer into complete Euclidean traces.","change_summary":"Trained all parameters on single Euclidean-step targets, then evaluated both a sealed 300-case single-step suite and the opened 480-case factorial trace diagnostic.","result":{"single_step_baseline":101,"single_step_candidate":177,"single_step_helped":83,"single_step_harmed":7,"single_step_p":1.3151874833452022e-17,"factorial_trace_baseline":131,"factorial_trace_candidate":122,"factorial_trace_p":0.24296021728332562,"step_paired_sha256":"75a6226c89e5a4b2acfac94059cec6102390ac585229f65cd7ec2a3775a6aab4","factorial_paired_sha256":"715dac634f0ecbedf623cbbc0d74670639ebc37eba010031b2823bc50d4e6c8f"},"decision":"reject as an integrated proof model; retain the strong isolated-operation result","failure_mode":"The learned arithmetic operation did not integrate with the longer natural-language proof policy and slightly reduced full-trace validity.","next_question":"Can loss reweighting improve digit execution without replacing the full-trace objective?"}
{"iteration":83,"timestamp":"2026-07-19T20:50:02Z","hypothesis":"Upweighting digit tokens inside the existing full-trace objective will improve exact arithmetic while preserving the proof policy.","change_summary":"Fine-tuned iteration 67 with digit-token-weighted full-trace loss and evaluated the 480-case factorial diagnostic.","result":{"baseline_trace_valid":131,"candidate_trace_valid":136,"helped":31,"harmed":26,"p":0.5966417603730826,"paired_sha256":"bc81f3bc17b5375e827f05e11c040bf4ba9650ef034bc5ad5a05ec8172d1dc46"},"decision":"reject","failure_mode":"Small gains and losses were mixed across magnitude and length cells, with no reliable overall improvement.","next_question":"Would a fixed-width decimal representation make place identity easier to use?"}
{"iteration":84,"timestamp":"2026-07-19T20:50:03Z","hypothesis":"Encoding every number with four decimal digits will stabilize place value and improve arithmetic after enough curriculum depth.","change_summary":"Progressively trained the full model for 300, 600, and 900 updates on fixed-width number prompts while keeping the evaluation contract fixed.","result":{"updates":900,"baseline_trace_valid":26,"candidate_trace_valid":16,"helped":5,"harmed":15,"p":0.04138946533203125,"paired_sha256":"bdeb73ef8d9913d9745a232f709839dcca15cb62699c61ee6a4659311914358d"},"decision":"reject","failure_mode":"Validation likelihood improved while verified execution became significantly worse; representation regularity did not produce usable arithmetic.","next_question":"Where in the chain does the promoted model actually fail?"}
{"iteration":85,"timestamp":"2026-07-19T20:50:04Z","hypothesis":"Long chains fail mainly through accumulated later-step errors.","change_summary":"Added an error-position analyzer and measured exact conditional transition accuracy on all 480 opened factorial traces from iteration 67.","result":{"count":480,"first_step_exact":253,"complete":131,"first_error_step1":227,"first_error_step2":92,"first_error_step3":18,"conditional_step1":0.5270833333333333,"conditional_step2":0.6363636363636364,"conditional_step3":0.875,"report_sha256":"2078d6d5f50b16f299fedbf34f2c8effec423df1acf0498128995dcdd567b0b4"},"decision":"falsify the primary chain-accumulation explanation for this model and task","failure_mode":"The first quotient-remainder transition dominates failures; conditional accuracy rises sharply after a correct prefix, though later accumulation remains secondary.","next_question":"Can training focused specifically on the first Euclidean sentence improve that entrance transition?"}
{"iteration":86,"timestamp":"2026-07-19T20:50:05Z","hypothesis":"A full-parameter objective focused on the first Euclidean sentence will improve first-step execution and may improve full traces.","change_summary":"Trained iteration 67 for 300 updates with loss only on the first Euclidean sentence; advanced a discovery gain to a fresh 300-case balanced confirmation excluding prior parameter triples.","result":{"fresh_count":300,"baseline_first_step":157,"candidate_first_step":170,"first_step_helped":19,"first_step_harmed":6,"first_step_p":0.01463329792022705,"baseline_trace_valid":80,"candidate_trace_valid":82,"trace_p":0.8318119049072266,"weights_sha256":"60b8a636906908e4f3dc0d984f0ba7a8e291f30bab5582f28d41a74ac5671f2c","paired_first_step_sha256":"30457203341f129cdb0dfc652fdb2130ed401363a056f2c0cf29e1609b129f22"},"decision":"validate as a first-step specialist but do not replace iteration 67 as the complete-trace checkpoint","failure_mode":"The targeted mechanism improved significantly, but the isolated model did not yield a significant whole-trace gain.","next_question":"Does sequentially adding second-step training integrate the specialist into full traces?"}
{"iteration":87,"timestamp":"2026-07-19T20:50:06Z","hypothesis":"Sequential first-step then second-step training will turn the entrance-step gain into a reliable full-trace gain.","change_summary":"Continued the first-step specialist for 300 second-step-focused updates, then evaluated it against iteration 67 on a fresh 300-case balanced v17 confirmation excluding 12,578 prior triples.","result":{"baseline_trace_valid":92,"candidate_trace_valid":96,"trace_helped":18,"trace_harmed":14,"trace_p":0.5966148958541453,"baseline_first_step":165,"candidate_first_step":171,"first_step_p":0.32693958282470703,"paired_trace_sha256":"8e048003cc8267aa200872bbc6d5fe5d793f1d77423831f9f8f03635e6341543"},"decision":"do not promote","failure_mode":"Discovery gains remained positive on fresh data but were small and statistically inconclusive.","next_question":"Would jointly focusing on the first two steps work better than sequential specialization?"}
{"iteration":88,"timestamp":"2026-07-19T20:50:07Z","hypothesis":"Simultaneously training loss on the first two Euclidean steps will outperform sequential specialization.","change_summary":"Trained iteration 67 for 600 updates with a simultaneous first-two-step mask and screened it against both iteration 67 and the sequential specialist.","result":{"count":120,"control_trace_valid":26,"candidate_trace_valid":30,"helped":5,"harmed":1,"p":0.21875,"sequential_trace_valid":37,"paired_control_sha256":"ab764195c70ab6d8a9cb21c773c1fed3dc916ab683482199ab13690dd481b97d"},"decision":"reject","failure_mode":"The candidate did not beat the sequential model and its gain over the control was not significant.","next_question":"Can the validated first-step specialist hand a short prefix to the stronger continuation checkpoint?"}
{"iteration":89,"timestamp":"2026-07-19T20:50:08Z","hypothesis":"A two-stage decoder using a first-step specialist only for the first sentence and iteration 67 for continuation will improve complete trace validity without requiring one model to learn both policies.","change_summary":"Built deterministic prefix extraction and staged-prediction combination. On the opened 120-case diagnostic, tested both an oracle first step and the trained specialist prefix before continuing with iteration 67.","result":{"baseline_trace_valid":26,"oracle_prefix_trace_valid":73,"oracle_helped":47,"oracle_harmed":0,"oracle_p":1.4210854715202004e-14,"specialist_prefix_trace_valid":34,"specialist_helped":8,"specialist_harmed":0,"specialist_p":0.0078125,"oracle_paired_sha256":"12757f7225a407e41b8f6ed73061a96475c7db97a82cf12753e5984ef97d4918"},"decision":"advance the frozen staged procedure to a fresh confirmation","failure_mode":"The specialist captures only a small fraction of the large causal headroom exposed by an oracle first step.","next_question":"Does the full frozen specialist-prefix procedure replicate against iteration 67 on fresh balanced data?"}
{"iteration":90,"timestamp":"2026-07-19T20:50:09Z","hypothesis":"The frozen first-step-specialist to iteration-67 continuation procedure will improve verified full traces on a fresh balanced benchmark.","change_summary":"Generated a fresh 300-case v18 suite balanced across six magnitude-length cells after excluding 12,878 prior triples; sealed baseline and staged predictions, verified all 300 oracle traces, and opened paired strict metrics only after generation.","result":{"count":300,"baseline_trace_valid":82,"staged_trace_valid":92,"helped":13,"harmed":3,"trace_p":0.021270751953125,"baseline_semantic":60,"staged_semantic":67,"semantic_p":0.0654296875,"baseline_first_step":155,"staged_first_step":163,"first_step_p":0.11531829833984375,"baseline_final_valid":103,"staged_final_valid":104,"specialist_prompts_per_second":1.0474647926103227,"continuation_prompts_per_second":0.7818899130438319,"baseline_prompts_per_second":0.6222538618877516,"peak_sequential_gb":1.392902916,"prompt_sha256":"288d0ae25440a45651c37fab55fdd8bdc846f03a0fda467f45adf75a82a1967b","verifier_sha256":"3741fcb14096d9b1b58dab030e58db60e14e733a681c16d92759ff1809f7dd89","paired_trace_sha256":"1a56ca895a0a81cb89e763a9d98ce23c24dd8eb1854c2ac9733f6b1cb0be55d0","paired_semantic_sha256":"2fe2b5b741e51372a33195d3d7ddbc157b124a5f1fb4abc27704235a63308aa0"},"decision":"promote the staged decoding procedure; retain iteration 67 as the canonical continuation checkpoint and iteration 89 as the first-step specialist","failure_mode":"The gain is narrow and requires two full checkpoint variants on disk; semantic and final-sentence metrics did not independently reach significance.","next_question":"Can the specialist delta be stored compactly without losing its first-step behavior?"}
